http://news.cnet.com/8301-1009_3-57505330-83/antisec-claims-to-have-snatched-12m-apple-device-ids-from-fbi/,http://news.cnet.com/8301-1009_3-57509595-83/udid-leak-source-idd-bluetoad-mobile-firm-says-it-was-hacked/,,20,Otro,"""Apple""",,,accidentally published,12400000,1,"tech, retail",,,2012,8,,y,12367232,CNET,"Hacking group AntiSec claimed they hacked an FBI laptop in March 2012 accessing a file of more than 12 million Apple Unique Device Identifiers (UDIDs). Subsequently, it was discovered that app developer BlueToad was the source of the breach. The list contained personal information such as full names, phone numbers and addresses. AntiSec published a million of these UDIDs online."
http://news.softpedia.com/news/Citi-Exposes-Details-of-150-000-Individuals-Who-Went-into-Bankruptcy-369979.shtml,,,20,Otro,Citigroup,,,accidentally published,150000,1,financial,,,2013,9,,y,150000,Softpedia,"Third big data breach from Citigroup.""The personal information of 150,000 consumers who went into bankruptcy between 2007 and 2011 – including their social security numbers – were exposed after Citi failed to properly redact court records before they were put on the Public Access to Court Electronic Records (PACER) system."""
http://boingboing.net/2013/05/23/terracom-and-yourtel-threaten.html,http://www.wired.co.uk/news/archive/2013-05/23/reporter-google-breach-hacker,,20,Otro,TerraCom & YourTel,,,accidentally published,180000,1,telecoms,,,2013,9,,y,170000,Boing Boing; Wired,"The telecom firms TerraCom and YourTel have branded reporters for Scripps News as ""hackers"" after journalists discovered that the personal data of over 170,000 customers - including social security numbers and other identifying data that could be used for identity theft - were sitting on a publicly accessible server."
http://www.msnbc.msn.com/id/8260050/ns/technology_and_science-security/t/million-credit-cards-exposed/#.UFiz7aRYtmg,,,300,Otro,Cardsystems Solutions Inc.,,,hacked,40000000,1,financial,,,2005,1,"Third-party payment processor for Visa, Mastercard, Amex,  and Discover",y,40000000,MSNBC,"CardSystems was fingered by MasterCard after it spotted fraud on credit card accounts and found a common thread, tracing it back to CardSystems.  An unauthorized entity put a specific code into CardSystems' network, enabling the person or group to gain access to the data. It's not clear how many of the 40 million accounts were actually stolen."
http://www.computerworld.com/s/article/9001150/KDDI_suffers_massive_data_breach,,,1,Otro,KDDI,,,hacked,4000000,1,telecoms,,,2006,2,Japanese telecommunications operator,y,4000000,Computer World,"Press report: ""Tokyo police have arrested two men for trying to extort nearly US$90,000 from KDDI Corp. The pair allegedly threatened to disclose the existence of storage media containing personal data belonging to four million KDDI customers prior to a shareholder meeting; however, KDDI alerted the police as soon as they were contacted by the blackmailers; the police monitored communications between KDDI and the pair for several weeks. """
http://news.bbc.co.uk/1/hi/6956349.stm,,,20,Otro,Monster.com,,,hacked,1600000,1,web,,,2007,3,Jobs website,y,1600000,BBC,"A trojan virus stole log-ins that were used to harvest user names, e-mail addresses, home addresses and phone numbers. Soon after phishing e-mails encouraged users to download a Monster Job Seeker Tool, which was in fact a program that encrypted files in their computer and left a ransom note demanding money for their decryption."
http://www.computerworld.com/s/article/9125078/CheckFree_warns_5_million_customers_after_hack,,,1,Otro,CheckFree Corporation,,,hacked,5000000,1,financial,,,2009,5,"Provider of online banking, online bill payment and electronic bill payment services for the financial services industry",y,5000000,Computer World,Customers who went to CheckFree's Web sites between 12:35 a.m. and 10:10 a.m. on the day of the attack were redirected to a Ukrainian Web server that used malicious software to try and install a password-stealing program on the victim's computer.
http://www.forbes.com/sites/davelewis/2015/05/31/heartland-payment-systems-suffers-data-breach/#155d10312985,,,300,Otro,Heartland,,,hacked,130000000,1,financial,,,2009,5,Independent payment processor,y,130000000,Guardian,"The biggest credit card scam in history, Heartland eventually paid more than $110 million to Visa, MasterCard, American Express and other card associations to settle claims related to the breach."
http://www.idtheftcenter.org/artman2/publish/lib_survey/ITRC_2008_Breach_List.shtml,,,4000,Otro,Virginia Dept. Of Health,,,hacked,8300000,1,"government, healthcare",,,2009,5,,y,8257378,ITRC,An extortion demand posted on WikiLeaks sought $10 million to return over 8 million patient records and 35 million prescriptions allegedly stolen from Virginia Department of Health Professions.  All 36 servers were shut down  to protect records.
http://www.idtheftcenter.org/artman2/publish/lib_survey/ITRC_2008_Breach_List.shtml,,,20,Otro,Virginia Prescription Monitoring Program,,,hacked,500000,1,healthcare,,,2009,5,,y,531400,ITRC,"A hacker, who was never arrested, demanded a $10 million ransom for a breach effecting 530,000 Virginians. Social security numbers may have been taken. The data was found in a database containing 35 million prescription records."
http://techcrunch.com/2009/12/14/rockyou-hack-security-myspace-facebook-passwords/,,,1,Otro,RockYou!,,,hacked,32000000,1,"web, gaming",,,2009,5,Developer of online games (Zoo World/Zoo World 2) and advertising products,y,32000000,Tech Crunch,"The site did not allow users to use special characters or punctuation in their passwords and e-mailed user passwords in plain text. Hackers took advantage of these security lapses, using simple techniques to gain access to 32 million user accounts."
http://www.fosters.com/apps/pbcs.dll/article?AID=/20110120/GJNEWS_01/701209744,http://www.hhs.gov/ocr/privacy/hipaa/administrative/breachnotificationrule/breachtool.html,,20,Otro,"Seacoast Radiology, PA",,,hacked,200000,1,healthcare,,,2010,6,,y,231400,US Gov,"Computer gamers hacked a server at Seacoast Radiology in Rochester in search of more bandwidth in November to play Call of Duty: Black Ops. In the process they also gained access to personal records of the more than 230,000 patients of the health center."
http://www.guardian.co.uk/technology/2010/jun/10/apple-ipad-security-leak?INTCMP=SRCH,,,1,Otro,AT&T,,,hacked,100000,1,telecoms,,,2010,6,US Telecoms company,y,114000,Guardian,"Details of iPad 3G users hacked from AT&T website, thought to include those of White House chief of staff Rahm Emanuel."
http://mashable.com/2011/05/31/sony-playstation-services-return/,,,1,Otro,Sony PSN,,,hacked,77000000,1,gaming,,,2011,7,,y,77000000,Mashable,"Rounding off a thoroughly unhappy year for Sony, their third breach saw the loss of 76,000,000 Sony PSN and Qriocity user accounts to hacking collective Lulzsec."
http://www.idtheftcenter.org/artman2/publish/lib_survey/ITRC_2008_Breach_List.shtml,,,50000,Otro,Massachusetts Government,,,hacked,200000,1,government,,,2011,7,Massachusetts Executive Office of Labor and Workforce,y,210000,ITRC,"Over 1,500 departmental computers were infected with the W32.QAKBOT virus, a malicious program which “downloads additional files, steals information, and opens a back door on the compromised computer”."
http://www.guelphmercury.com/news-story/2200845-honda-canada-hit-by-online-security-breach-283-000-car-owners-personal-data-stolen/,,,20,Otro,Honda Canada,,,hacked,300000,1,retail,,,2011,7,,y,283000,Guelph Mercury,"Names, addresses and vehicle identification numbers were taken from the company’s eCommerce websites myHonda and myAcura"
http://mashable.com/2011/06/02/sony-pictures-hacked/,,,1,Otro,Sony Pictures,,,hacked,1000000,1,web,,,2011,7,,y,1000000,Mashable,"LulzSec hacking collective stated all of the information it took was unencrypted, “Sony stored over 1,000,000 passwords of its customers in plaintext."" More than 1 million user accounts were compromised. An additional 75,000 music codes and 3.5 million coupons were also uncovered."
http://www.nydailynews.com/news/national/russians-ukrainian-charged-largest-hacking-spree-u-s-history-article-1.1408948,,,50000,Otro,Massive American business hack,,,hacked,160000000,1,financial,,,2012,8,"7-Eleven, JC Penney, Hannaford, Heartland, JetBlue, Dow Jones, Euronet, Visa Jordan, Global Payment, Diners Singapore and Ingenicard",y,160000000,NY Daily,"Over eight years, a hacking ring targeted banks, payment processors and chain stores, to steal more than 160 million credit and debit card numbers, targeting more than 800,000 bank accounts"
http://www.zdnet.com/blog/security/3-million-bank-accounts-hacked-in-iran/11577,,,50000,Otro,Three Iranian banks,,,hacked,3000000,1,financial,,,2012,8,"Saderat, Eghtesad Novin, & Saman",y,3000000,ZD Net,"After finding a security vulnerability in Iran's banking system, software manager Khosrow Zarefarid
 wrote a formal report and sent it to the CEOs of all the affected banks across the country. When the banks ignored his findings, he hacked 3 million bank accounts, belonging to at least 22 different banks, to prove his point."
http://www.idtheftcenter.org/artman2/publish/lib_survey/ITRC_2008_Breach_List.shtml,,,20,Otro,Medicaid,,,hacked,800000,1,"government, healthcare",,,2012,8,US health program for low income people and families,y,780000,ITRC,"The Utah Department of Technology Services had recently moved their claims records to a new server, and hackers believed to be operating out of Eastern Europe were able to circumvent the server’s multi-layered security system containing Social Security numbers for the Medicaid claims."
http://news.cnet.com/8301-1009_3-57469944-83/formspring-disables-user-passwords-in-security-breach/?tag=mncol;txt,,,1,Otro,Formspring,,,hacked,400000,1,web,,,2012,8,Interest-based social Q&A website,y,420000,CNET,"Formspring was tipped off to a breach after 420,000 hashed passwords were posted to a security forum."
http://arstechnica.com/security/2013/07/hack-exposes-e-mail-addresses-password-data-for-2-million-ubuntu-forum-users/,,,300,Otro,Ubuntu,,,hacked,2000000,1,tech,,,2013,9,"The discussion forum for the popular alternative, open-source operating system",y,2000000,Data Loss Database,July 2013: Discussion forum for the operating system was compromised leaking personal details and password. The passwords were cryptographically scrambled using the MD5 hashing algorithm - considered an inadequate means of protecting stored passwords by security experts.
http://krebsonsecurity.com/2013/09/data-broker-giants-hacked-by-id-theft-service/,,,20,Otro,ssndob.ms,,,hacked,4000000,1,web,,,2013,9,,y,4000000,Krebs on Security,"SSNDOB was an underground identity theft service. Teenage hackers used it to collect data for exposed.su, a site that listed the SSNs, birthdays, phone numbers, current and previous addresses for dozens of top celebrities including Beyonce, Kanye West and Michelle Obama. In doing so they revealed SSNDOB had data on more than 4 million people."
http://dealbook.nytimes.com/2014/10/02/jpmorgan-discovers-further-cyber-security-issues/?_php=true&_type=blogs&_r=0,,,300,Otro,JP Morgan Chase,,,hacked,76000000,1,financial,,,2014,10,,y,76000000,Deal Book,"July 2014: The US's largest bank was compromised by hackers, stealing names, addresses, phone numbers and emails of account holders. The hack began in June but was not discovered until July, when the hackers had already obtained the highest level of administrative privilege to dozens of the bank’s computer servers."
http://www.reuters.com/article/2013/07/18/net-us-nasdaq-cybercrime-website-idUSBRE96H1F520130718,,,1,Otro,NASDAQ,,,hacked,500000,1,financial,,,2014,10,Nasdaq OMX Group,y,500000,Reuters,"Nasdaq forum website hacked by hacking ring, email addresses and passwords compromised"
http://money.cnn.com/2014/08/18/technology/security/hospital-chs-hack/,,,20,Otro,Community Health Systems,,,hacked,4500000,1,healthcare,,,2014,10,,y,4500000,CNN,"Aug 2014: Community Health Systems, which operates 206 hospitals across the US, had patient data from the last 5 years breached. Details included names, addresses, social security numbers. Suspected ""chinese hackers"" were thought responsible. Goal: identity theft."
http://krebsonsecurity.com/2014/09/banks-credit-card-breach-at-home-depot/,,,300,Otro,Home Depot,,,hacked,56000000,1,retail,,,2014,10,,y,56000000,Krebs on Security,"Malware installed on cash register system across 2,200 stores syphoned credit card details of up to 56 million customers. May be the same group of Russian and Ukrainian hackers responsible for the data breaches at Target, Sally Beauty and P.F. Chang’s, among others"
http://my.chicagotribune.com/#section/-1/article/p2p-80265168/,,,1,Otro,Ebay,,,hacked,145000000,1,web,,,2014,10,,y,145000000,Chicago Tribune,The company has said hackers attacked between late February and early March with login credentials obtained from “a small number” of employees. They then accessed a database containing all user records and copied “a large part” of those credentials.
http://www.theguardian.com/technology/2015/jul/06/hacking-team-hacked-firm-sold-spying-tools-to-repressive-regimes-documents-claim,,,50000,Otro,Hacking Team,,,hacked,500000,1,web,,,2015,11,,y,500000,The Guardian,"Italian cybersecurity firm sells digital surveillance software to law enforcement and national security organisations. 400 GB of documents - including software source code, private messages & client databases - has been stolen and put online  via BitTorrent. The documents show the company has sold products to repressive regimes."
http://www.anthemfacts.com/faq,,,20,Otro,Anthem,,,hacked,80000000,1,healthcare,,,2016,12,Second-largest health insurer in the US,y,80000000,Anthem Facts,"Feb 2015: Names, dates of birth, member ID/ social security numbers, addresses, phone numbers, email addresses and employment information."
http://panamapapers.sueddeutsche.de/articles/56febff0a1bb8d3c3495adf4/,,,50000,Otro,Mossack Fonseca,,,hacked,11500000,1,legal,,,2016,12,Panamanian law firm,y,11500000,PanamaPapers,"2.6TB of data on politicians, criminals, professional athletes etc leaked from law firm Mossack Fonseca, including emails, contracts, scanned documents, transcripts..."
http://motherboard.vice.com/read/hacker-steals-900-gb-of-cellebrite-data,,,20,Otro,Cellebrite,,,hacked,3000000,1,tech,,,2017,13,,y,3000000,Motherboard,Cellebrite's main product is a device that rips data from mobile phones. 900GB of data was stolen from Cellebrite. The hackers got hacked. The number of records taken is unknown.
https://www.consumer.ftc.gov/blog/2017/09/equifax-data-breach-what-do,,,50000,Otro,Equifax,,,hacked,143000000,1,financial,,,2017,14,,y,143000000,UK Gov,"If you have a credit report, there’s a good chance that you’re one of the 143 million American consumers whose sensitive personal information was exposed in a data breach at Equifax, one of the nation’s three major credit reporting agencies."
http://www.idtheftcenter.org/artman2/publish/lib_survey/ITRC_2008_Breach_List.shtml,http://www.computerworld.com/s/article/9072198/Programmer_who_stole_drive_containing_1_million_bank_records_gets_42_months,,300,Otro,Compass Bank,,,inside job,1000000,1,financial,,,2007,3,,y,1000000,ITRC,"A former employee stole a hardrive containing 1m account details from the bank, then used it to defraud cutomers of nearly $32,000."
http://www.guardian.co.uk/news/datablog/2010/nov/29/wikileaks-cables-data,,,50000,Otro,US Military,,,inside job,300000,1,military,,,2010,6,Wikileaks / Bradley Manning/Cablegate.,y,260000,Guardian,WIKILEAKS!
http://uk.businessinsider.com/snowden-leaks-timeline-2016-9,,,50000,Otro,National Security Agency,,,inside job,1500000,1,government,,,2013,9,,y,1500000,Business Insider,"Snowden downloaded up to 1.5 million files, then flew to Hong Kong to meet journalists Glenn Greenwald and Laura Poitras before fleeing to Moscow."
http://www.securityweek.com/attacker-steals-data-2-million-vodafone-germany-customers,,,300,Otro,Vodafone,,,inside job,2000000,1,telecoms,,,2013,9,,y,2000000,Security Week,An IT contractor for the firm used his deep access to the telecom giant's system to copy customer names and bank account details.
http://www.nytimes.com/2005/06/07/business/07data.html?pagewanted=all&_moc.semityn.www,,,300,Otro,Citigroup,,,lost / stolen device or media,3900000,1,financial,,,2005,1,,y,3900000,NY Times,Blame the messenger! A box of computer tapes containing information on 3.9 million customers was lost by United Parcel Service (UPS) while in transit to a credit reporting agency.
http://news.cnet.com/Laptop-with-HP-employee-data-stolen/2100-7348_3-6052964.html,,,20,Otro,Hewlett Packard,,,lost / stolen device or media,200000,1,"tech, retail",,,2006,2,,y,200000,CNET,"Laptop lost/stolen containing employee data: names, addresses, Social Security numbers, dates of birth and other employment-related information."
http://www.idtheftcenter.org/artman2/publish/lib_survey/ITRC_2008_Breach_List.shtml,,,4000,Otro,University of Utah Hospitals & Clinics,,,lost / stolen device or media,2200000,1,academic,,,2008,4,stolen data tapes,y,2200000,ITRC,The data tapes were stolen by petty thieves from an employee's car. According to police reports the thieves tried - and failed - to view the tapes using a VHS player.
http://news.bbc.co.uk/1/hi/uk_politics/7667507.stm,,,50000,Otro,UK Ministry of Defence,,,lost / stolen device or media,1700000,1,government,,,2008,4,,y,1700000,BBC News,"Hard drive containing very sensitive details of Armed Forces personnel - passport & national insurance numbers, bank details etc - went missing. Loss was revealed during National Identity Fraud Prevention Week."
http://www.idtheftcenter.org/artman2/publish/lib_survey/ITRC_2008_Breach_List.shtml,http://privacyblog.littler.com/2011/01/articles/identity-theft/after-starbucks-laptop-is-stolen-alleged-victims-of-identity-theft-win-pyrrhic-victory/,,20,Otro,Starbucks,,,lost / stolen device or media,100000,1,retail,,,2008,4,,y,97000,ITRC,"A laptop was stolen that contained private information on 97,000 employees, including names, addresses and Social Security numbers. Employees tried to sue Starbucks in California winning their case in the appeals court before losing in the higher federal court as they were unable to prove any cognizable harm or injury."
http://www.idtheftcenter.org/artman2/publish/lib_survey/ITRC_2008_Breach_List.shtml,,,1,Otro,AT&T,,,lost / stolen device or media,100000,1,telecoms,,,2008,4,,y,113000,ITRC,"A laptop was stolen from a car containing unencrypted Social
Security numbers and bonus/salary info of AT&T employees."
http://www.idtheftcenter.org/artman2/publish/lib_survey/ITRC_2008_Breach_List.shtml,,,4000,Otro,Health Net,,,lost / stolen device or media,1500000,1,healthcare,,,2009,5,Largest US publicly traded managed health care company,y,1500000,ITRC,A portable hard drive with seven years of personal and medical information on about 1.5 million Health Net customers was lost for six months before being reported.
http://security-hack1.blogspot.com/2010/04/affinity-health-plan-alerts-public.html,http://www.hhs.gov/ocr/privacy/hipaa/administrative/breachnotificationrule/breachtool.html,,4000,Otro,"Affinity Health Plan, Inc.",,,lost / stolen device or media,300000,1,healthcare,,,2009,5,,y,344579,US Gov,A rented photocopier used to copy health records did not have its hard-drive wiped before its return.
http://www.scmagazine.com/thief-steals-57-hard-drives-from-bluecross-blueshield-of-tennessee/article/162178/,http://www.hhs.gov/ocr/privacy/hipaa/administrative/breachnotificationrule/breachtool.html,,20,Otro,Blue Cross Blue Shield of Tennessee,,,lost / stolen device or media,1000000,1,healthcare,,,2009,5,US health insurance organization,y,1023209,US Gov,"A thief stole 57 hard drives from the closet of a BlueCross call center in Chattanooga, Tenn. Data on the stolen hard drives was encoded but not encrypted. Bluecross stated there was no evidence the information was accessed due to the specialized nature of the hardware stolen."
http://www.idtheftcenter.org/artman2/publish/lib_survey/ITRC_2008_Breach_List.shtml,,,20,Otro,US National Guard,,,lost / stolen device or media,130000,1,military,,,2009,5,,y,131000,ITRC,"About 131,000 former and current Army Guard members potentially affected  when a personal laptop owned by an Army Guard contractor was stolen. Database incuded names, Social Security Numbers, incentive payment amounts and payment dates."
http://www.idtheftcenter.org/artman2/publish/lib_survey/ITRC_2008_Breach_List.shtml,,,20,Otro,US Dept of Defense,,,lost / stolen device or media,72000,1,military,,,2009,5,,y,72000,ITRC,"""According to a report to Congress, assessment forms of 72,000 service members who returned from deployment to Iraq or Afghanistan between Jan 1, 2007 to May 31, 2008 were breached. The forms ask for the service member's SSN,. Name, date of birth."""
http://www.wired.com/threatlevel/2009/10/probe-targets-archives-handling-of-data-on-70-million-vets/,,,20,Otro,US Military,,,lost / stolen device or media,76000000,1,military,,,2009,5,,y,76000000,ITRC,"Without first destroying the data the agency sent back a defective unencrypted hard drive for repair and recycling which held detailed records on 76 million veterans, including millions of Social Security numbers dating to 1972."
http://www.pcworld.com/article/131453/article.html,,,300,Otro,JP Morgan Chase,,,lost / stolen device or media,2600000,1,financial,,,2010,6,,y,2600000,ITRC,"In 2007, the personal information of approximately 2.6 million current and former holders of a Chase-Circuit City credit card had been mistakenly identified as trash and thrown out in garbage bags outside five branch offices in New York."
http://www.foxnews.com/us/2010/03/26/student-loan-company-data-m-people-stolen/,,,20,Otro,Educational Credit Management Corp,,,lost / stolen device or media,3300000,1,financial,,,2010,6,US student loan guarantor,y,3300000,ITRC,"A contractor for the US Department of Education stole the records of 3.3 million people. Data included names, addresses, Social Security numbers and dates of birth of borrowers, but no financial or bank account information."
http://www.idtheftcenter.org/artman2/publish/lib_survey/ITRC_2008_Breach_List.shtml,,,300,Otro,Morgan Stanley Smith Barney,,,lost / stolen device or media,35000,1,financial,,,2011,7,,y,34000,ITRC,Morgan Stanley mailed a CD containing sensitive data about investors in tax-exempt funds and bonds to the New York State Department of Taxation and Finance. The package arrived at the building but when it arrived at the relevant desk the data CD was missing.
http://www.techweekeurope.co.uk/news/nhs-researchers-lose-laptop-with-8m-patients-records-31810,,,4000,Otro,NHS,,,lost / stolen device or media,8300000,1,healthcare,,,2011,7,"UK's national health service, govt funded",y,8300000,Tech Week,A laptop holding the unencrypted records of eight million patients went missing from an NHS store room and wasn't reported until 3 weeks later.
http://healthitsecurity.com/2013/08/27/advocate-medical-group-endures-massive-data-breach/,http://datalossdb.org/latest_incidents_remote_sync,,20,Otro,Advocate Medical Group,,,lost / stolen device or media,4000000,1,healthcare,,,2013,9,,y,4000000,Health IT Security,"4,000,000 patient names, addresses, dates of birth, and Social Security numbers were contained in four computers stolen from an administrative building. Second biggest security breach ever reported to the Department of Health and Human Services (HHS)."
https://medium.com/@vijayp/f6bc289679a1,,,1,Otro,New York Taxis,,,poor security,52000,1,transport,,,2014,10,,y,52000,Medium,"A freedom of information request resulted in the release of data on all 173 million journeys undertaken by New York taxis in one year. Unfortunately, the data was incorrectly anonymised and relatively easy to decode, revealing the driver IDs, pickup & dropoff times, and GPS routes taken for every single cab journey."
https://www.thelocal.se/20170717/swedish-authority-handed-over-keys-to-the-kingdom-in-it-security-slip-up,,,50000,Otro,Swedish Transport Agency,,,poor security,3000000,1,government,,,2017,14,,y,3000000,The Local,"Information about all vehicles in the country (including military and police), made available to IT workers who hadn't been through usual security checks. The question of whether or not Sweden's national security was harmed is censored in the Säpo (Sweden's security police) report."
http://helpx.adobe.com/x-productkb/policy-pricing/customer-alert.html,http://www.zdnet.com/adobe-admits-2-9m-customer-accounts-have-been-compromised-7000021546/,http://krebsonsecurity.com/2013/10/adobe-breach-impacted-at-least-38-million-users/,50000,Otro,Adobe,,,hacked,36000000,1,tech,,,2013,9,,y,36000000,Adobe,"Sep 17th 2013. Hackers obtained access to a large swathe of Adobe customer IDs and encrypted passwords & removed sensitive information (i.e. names, encrypted credit or debit card numbers, expiration dates, etc.). Approximately 36 million Adobe customers were involved: 3.1 million whose credit or debit card information was taken and nearly 33 million active users whose current, encrypted passwords were in the database taken. Correction Jan 2015: we previously reported 152m records were taking, but the remainder affected invalid, inactive, test accounts or had out-of-date passwords associated with them."
