http://nakedsecurity.sophos.com/2013/04/27/livingsocial-hacked-50-million-affected/,http://bits.blogs.nytimes.com/2013/04/26/living-social-hack-exposes-data-for-50-million-customers/,,1,Otro,Living Social,,,hacked,50000000,1,web,,,2013,9,special offers website,,50000000,Naked Security; New York Times,"Online criminals gained access to user names, e-mail addresses, dates of birth & encrypted passwords for 50 million people. Databases storing financial information were not compromised in the attack, the company said."
http://www.wired.co.uk/news/archive/2013-03/04/evernote-hacked,http://www.digitaltrends.com/mobile/evernote-hack-50-million-users-forced-to-reset-passwords/,,1,Otro,Evernote,,,hacked,50000000,1,web,,,2013,9,online note-taking site,,50000000,Wired; Digital Trends,"Evernote asked its 50 million users to reset their passwords following an attempt to hack the note-taking network. The company said it’d found no evidence that any payment information for Evernote Premium or Evernote Business customers had been accessed, nor was there any indication that content stored by users had been accessed, changed or lost."
http://nakedsecurity.sophos.com/2013/04/05/scribd-worlds-largest-online-library-admits-to-network-intrusion-password-breach/,http://www.nbcnews.com/technology/scribd-hack-exposes-thousands-users-1B9239618,,1,Otro,Scribd,,,hacked,500000,1,web,,,2013,9,"""world's largest online library""",,500000,Naked Security; NBC News,Hack resulted in a few hundred thousand stolen passwords.
http://www.forbes.com/sites/andygreenberg/2012/01/15/zappos-says-hackers-accessed-24-million-customers-account-details/,,,20,Otro,SnapChat,,,hacked,4700000,1,"web, tech",,,2013,9,,,4700000,Forbes,"31st Dec 2013. Hackers abused an exploit to syphon 4.7m user details, including phone numbers.  Check here to see if your account was compromised: http://lookup.gibsonsec.org/"
https://blog.imgur.com/2017/11/24/notice-of-data-breach/,,,4000,Otro,Imgur,,,hacked,1700000,1,app,,,2014,10,,,1700000,Imgur,"Imgur are still investigating how the breach took place. The data was stolen in 2014, but Imgur claim they only discovered it in Nov 2017."
http://www.cityam.com/1406190300/ecb-website-hacked,,,1,Otro,European Central Bank,,,hacked,4000000,1,financial,,,2014,10,,,4000000,City am,
http://www.reuters.com/article/us-hsbc-turkey-cybersecurity/hsbc-turkey-says-customer-credit-card-data-stolen-idUSKCN0IW1RR20141112,,,50000,Otro,HSBC Turkey,,,hacked,2700000,1,financial,,,2014,10,,,2700000,Reuters,"""In a message to customers on its website, the bank said an attack on its credit card and debit card systems in Turkey had been thwarted but card numbers, account numbers, card expiry dates and customer names had been “compromised”."""
http://blog.twitch.tv/2015/03/important-notice-about-your-twitch-account/,,,1,Otro,Twitch.tv,,,hacked,10000000,1,healthcare,,,2014,10,Gaming site,,10000000,Twitch,March 23rd. Details unknown at this point. All Twitch's 10 million users have been requested to change their passwords.
http://www.buzzfeed.com/tomgara/sony-hack,,,20,Otro,Sony Pictures,,,hacked,10000000,1,media,,,2014,10,,,10000000,Buzzfeed,"Wide-ranging hack of potentially every piece of data held by the company, including: unreleased films & scripts, employee social security numbers, salaries and health check results, as well as sensitive internal business documents relating to lay-offs, restructures and executive salaries. Lead suspects are ""North Korean hackers"" perhaps related to the Seth Rogen film, ""The Interview"" which mocks the North Korean dictator, Kim Jong Un."
http://fortune.com/2014/12/19/staples-cards-affected-breach/,,,300,Otro,Staples,,,hacked,1200000,1,retail,,,2014,10,,,1160000,Fortune,
http://time.com/3151681/ups-hack/,,,300,Otro,UPS,,,hacked,4000000,1,retail,,,2014,10,,,4000000,Time,Malware was discovered in the credit & debit card processing systems at 51 branches in 24 states.
http://www.nytimes.com/2014/01/24/business/neiman-marcus-breach-affected-1-1-million-cards.html,http://krebsonsecurity.com/2014/08/stealthy-razor-thin-atm-insert-skimmers/,,20,Otro,Neiman Marcus,,,hacked,1100000,1,retail,,,2014,10,US retailer,,1100000,NY Times,
http://online.wsj.com/articles/japan-airlines-reports-hacker-attack-1412053828,http://www.jal.co.jp/en/info/other/140924.html,,20,Otro,Japan Airlines,,,hacked,800000,1,transport,,,2014,10,,,750000,WSJ,"Oct 2014: Japan Airlines confirmed the possible theft of information from up to around 750,000 frequent-flier programme members. Data that may have been stolen included names, genders, birth dates, addresses, email addresses and places of work."
http://blog.aol.com/2014/04/28/aol-security-update/,,,1,Otro,AOL,,,hacked,24000000,1,web,,,2014,10,,,2400000,AOL,
http://uk.businessinsider.com/yahoo-hack-by-state-sponsored-actor-biggest-of-all-time-2016-9?r=US&IR=T,,,20,Otro,Yahoo,,,hacked,500000000,1,web,,,2014,10,,,500000000,Business Insider,"Happened in 2014, but no. records stolen was originally thought to be much smaller. Yahoo recently revealed the real numbers."
https://www.theguardian.com/news/2018/mar/17/cambridge-analytica-facebook-influence-us-election?CMP=twt_gu,,,1,Otro,Facebook,,,hacked,50000000,1,web,,,2014,10,,,50000000,Guardian,"Cambridge Analytica, headed at the time by Steve Bannon, harvested 50m profiles in early 2014 to build a system that could profile US voters and target them with political adverts."
http://www.theguardian.com/technology/2014/jun/16/dominos-pizza-ransom-hack-data,,,1,Otro,Dominios Pizzas (France),,,hacked,600000,1,web,,,2014,10,,,600000,The Guardian,
http://www.wired.co.uk/news/archive/2013-11/13/mac-rumours-forums-hacked,,,1,Otro,MacRumours.com,,,hacked,900000,1,web,,,2014,10,,,860000,Wired,
http://www.dailydot.com/politics/invest-bank-hacker-buba/,,,50000,Otro,Invest Bank,,,hacked,40000,1,financial,,,2015,11,United Arab Emirates bank,,40000,Daily Dot,"Hacker breached a United Arab Emirates bank, demanding a ransom of $3m in bitcoin to stop tweeting data, mostly about corporate accounts. The hacker dumped files on the website of a basketball team, which he hacked for storage. The bank, Invest Bank, won't pay the ransom."
http://money.cnn.com/2015/05/26/pf/taxes/irs-website-data-hack/index.html,,,1,Otro,IRS,,,hacked,100000,1,government,,,2015,11,US Tax service,,100000,CNN,"""An unnamed cybermafia used an IRS app to download forms full of personal information. They posed as legitimate taxpayers, and tried to download forms on 200,000 people between February and May. They got away with half of them, the IRS said. The crooks used about 15,000 of them to claim tax refunds in other people's names."""
http://www.washingtonpost.com/world/national-security/chinese-hackers-breach-federal-governments-personnel-office/2015/06/04/889c0e52-0af7-11e5-95fd-d580f1c5d44e_story.html?tid=hpModule_04941f10-8a79-11e2-98d9-3012c1cd8d1e,,,20,Otro,US Office of Personnel Management,,,hacked,4000000,1,government,,,2015,11,,,4000000,Washington Post,"""The intruders... gained access to...employees’ Social Security numbers, job assignments, performance ratings and training information"""
http://www.bbc.co.uk/news/world-us-canada-33120405,http://www.reuters.com/article/2015/07/09/us-cybersecurity-usa-idUSKCN0PJ2M420150709?feedType=RSS&feedName=topNews&utm_source=twitter,,50000,Otro,US Office of Personnel Management (2nd Breach),,,hacked,21500000,1,government,,,2015,11,,,21500000,BBC News,"attackers have targeted the forms submitted by intelligence and military personnel for security clearances. The document includes personal information - everything from eye colour, to financial history, to past substance abuse, as well as contact details for the individual's friends and relatives"
http://carefirstanswers.com/,,,1,Otro,Carefirst,,,hacked,1100000,1,healthcare,,,2015,11,"Blue Cross, Blue Shield US medical insurer",,1100000,Carefirst,Attacked happened in June 2014. Was announced in June 2015.
http://premeraupdate.com/,,,50000,Otro,Premera,,,hacked,11000000,1,healthcare,,,2015,11,US healthcare provider,,11000000,Premera,"Detected 29th Jan 2015. Occured May 2014. ""C could include names, date of birth, email address, address, telephone number, Social Security number, member identification numbers, bank account information, and claims information, including clinical information"""
http://www.theguardian.com/business/2015/mar/29/british-airways-frequent-flyer-accounts-hacked,,,1,Otro,British Airways,,,hacked,500000,1,retail,,,2015,11,Frequent flyer accounts,,500000,The Guardian,
http://krebsonsecurity.com/2015/05/mobile-spy-software-maker-mspy-hacked-customer-data-leaked/,,,20,Otro,MSpy,,,hacked,400000,1,tech,,,2015,11,kid & partner tracking service,,400000,Krebs on Security,"Data dump to the dark web ""includes Apple IDs and passwords, tracking data, and payment details on some 145,000 successful transactions"", photos and very private conversations."
http://techcrunch.com/2015/03/27/slack-got-hacked/,,,1,Otro,Slack,,,hacked,500000,1,tech,,,2015,11,software for remote working,,500000,Tech Crunch,
http://www.channel4.com/news/adult-friendfinder-dating-hack-internet-dark-web,,,1,Otro,Adult Friend Finder,,,hacked,3900000,1,web,,,2015,11,Internet dating & hookup site,,3900000,Channel 4,"Sexual preferences, names, email addresses, usernames, dates of birth, postal codes"
http://krebsonsecurity.com/2015/07/online-cheating-site-ashleymadison-hacked/,,,1,Otro,AshleyMadison.com,,,hacked,37000000,1,web,,,2015,11,US ex-marital affairs site,,37000000,Krebs on Security,"20th July 2015: DEVELOPING: Online hookup site for extra-marital affairs has been severely breached and the personal details of 37m users, as well as company financial records, threatened with release. Notorious hacking outfit The Impact Team has claimed responsibility. The hackers are demanding the shutdown of AM.com and other associated sites."
http://www.reuters.com/article/2015/10/02/us-tmobile-dataprotection-idUSKCN0RV5PL20151002,,,300,Otro,Experian / T-mobile,,,hacked,15000000,1,web,,,2015,11,,,15000000,Reuters,"The world's biggest data monitoring firm disclosed a massive breach of customers who applied for service with T-Mobile. Names, addresses, birth dates, Social Security numbers, drivers license numbers and passport numbers."
http://www.theguardian.com/technology/2015/aug/10/carphone-warehouse-uk-data-watchdog-investigating-customer-hack,,,50000,Otro,CarPhone Warehouse,,,hacked,2700000,1,web,,,2015,11,UK mobile phone supplier,,2700000,The Guardian,
https://theintercept.com/2015/11/11/securus-hack-prison-phone-company-exposes-thousands-of-calls-lawyers-and-clients/,,,50000,Otro,Securus Technologies,,,hacked,70000000,1,web,,,2015,11,Prison phone service provider,,70000000,The Intercept,"Anonymous hacker leaked records of over 70m phone calls, plus links to recordings. Recording/storing attorney-client calls potentially violates constitutional protections."
http://www.theguardian.com/technology/2015/dec/02/vtech-hack-us-hong-kong-investigate-children-exposed,http://www.troyhunt.com/2015/11/when-children-are-breached-inside.html,,50000,Otro,VTech,,,hacked,6400000,1,web,,,2015,11,Toymaker company,,6400000,The Guardian,"Software used to download games to children's computer tablets was hacked, with personal info and photos stolen."
https://thestack.com/security/2015/12/15/mackeeper-discloses-13-million-mac-users-details-with-poor-hash-protection/,https://www.reddit.com/r/apple/comments/3wq9fc/massive_data_breach/,,1,Otro,Kromtech,,,hacked,13000000,1,web,,,2015,11,MacKeeper software,,13000000,The Stack,"A security researcher stumbled on a leak, which exposed usernames, email addresses and passwords of users. He notified Kromtech, who patched it quickly."
https://www.bbc.co.uk/news/amp/technology-42075306,,,1,Otro,Uber,,,hacked,57000000,1,app,,,2016,12,,,57000000,BBC,"Uber paid the hackers $100,000 to delete the stolen data. Chief security officer Joe Sullivan has resigned."
http://www.businessinsider.com/turkish-citizenship-database-allegedly-hacked-and-leaked-2016-4?r=UK&IR=T,,,20,Otro,Turkish citizenship database,,,hacked,49611709,1,government,,,2016,12,,,49611709,Business Insider,Turkish citizenship database has allegedly been hacked and leaked online.
http://news.softpedia.com/news/syrian-government-hacked-43-gb-of-data-spilled-online-by-hacktivists-502765.shtml,,,1,Otro,Syrian government,,,hacked,274477,1,government,,,2016,12,,,274477,Softpedia,"Hacking outfit calling itself 'Cyber Justice Team' leaked 10GB of data from the government and private websites. Seems to be just data from old leaks, though."
http://blog.trendmicro.com/trendlabs-security-intelligence/55m-registered-voters-risk-philippine-commission-elections-hacked/,,,50000,Otro,Philippines’ Commission on Elections,,,hacked,55000000,1,government,,,2016,12,COMELEC,,55000000,Trend Micro,"After a message was posted on the COMELEC website by hackers from Anonymous, warning the government not to mess with the elections, the entire database was stolen and posted online."
https://www.bannerhealth.com/news/2016/08/banner-health-identifies-cyber-attack#,,,300,Otro,Banner Health,,,hacked,3700000,1,healthcare,,,2016,12,,,3700000,Banner Health,Hackers gained access to payment card data via food outlets at Banner Health locations.
http://abcnews.go.com/Technology/wireStory/wendys-1000-restaurants-affected-hack-40407208,,,300,Otro,Wendy's,,,hacked,1025,1,retail,,,2016,12,Restaurant chain,,1025,ABC News,Malware has been used in 1025 of Wendy's restaurants to steal credit card data from customers. It's currently unknown how many individuals have been impacted.
http://betanews.com/2016/07/15/ubuntu-linux-forums-hacked/,,,1,Otro,Linux Ubuntu forums,,,hacked,2000000,1,web,,,2016,12,,,2000000,Beta News,
https://www.europol.europa.eu/iocta/2016/data-breach.html,,,4000,Otro,Fling,,,hacked,40000000,1,web,,,2016,12,Dating site,,40000000,Europol,"A hacker claims to be selling info on sexual desires & preferences, as well as generic personal info, stolen from the dating site Fling."
http://motherboard.vice.com/read/427-million-myspace-passwords-emails-data-breach,,,1,Otro,MySpace,,,hacked,164000000,1,web,,,2016,12,,,164000000,Motherboard,"The same hacker who was selling LinkedIn user data now claims to have MySpace user data too, and lots of it."
http://motherboard.vice.com/read/another-day-another-hack-7-million-emails-and-hashed-passwords-for-minecraft,,,1,Otro,Minecraft,,,hacked,7000000,1,web,,,2016,12,Lifeboat' community,,7000000,Motherboard,Players using the Lifeboat servers have had their email addresses and passwords leaked.
http://motherboard.vice.com/read/another-day-another-hack-100-million-accounts-for-vk-russias-facebook,,,4000,Otro,VK,,,hacked,100544934,1,web,,,2016,12,Russia's Facebook,,100544934,Motherboard,"Over 100m user accounts were hacked and the data put up for sale online. A VK spokesperson has denied that the site was breached, claiming the data for sale is old details no longer in use."
https://torrentfreak.com/utorrent-forums-hacked-passwords-compromised-160608/,,,1,Otro,uTorrent,,,hacked,35000,1,web,,,2016,12,,,35000,Torrent Freak,"It's unclear what data has been breached, exactly, but uTorrent has advised passwords are probably compromised."
http://www.zdnet.com/article/over-25-million-accounts-stolen-after-mail-ru-forums-raided-by-hackers/,,,20,Otro,Mail. ru,,,hacked,25000000,1,web,,,2016,12,Game-related forums,,25000000,ZD Net,Two hackers attacked three game-related forums hosted by Russian company Mail.ru.
http://www.bgr.in/news/indian-hacker-group-leaks-data-of-1-7-million-snapchat-users-after-ceos-poor-country-comments-report/,,,1,Otro,SnapChat,,,hacked,1700000,1,app,,,2017,13,,,1700000,BGR,Apr. Indian hackers apparently leaked data they stole last year in response to Snapchat CEO allegedly stating they had no plans to expand to 'poor countries' like India. Snapchat have yet to confirm any leak.
https://www.theguardian.com/business/2017/apr/09/wonga-data-breach-could-affect-250000-uk-customers?CMP=Share_iOSApp_Other,,,50000,Otro,Wonga,,,hacked,270000,1,financial,,,2017,13,,,270000,The Guardian,Apr. Customers from the UK and Poland look to have been affected.
https://techcrunch.com/2016/07/29/clinton-campaign-reportedly-breached-by-hackers/,,,20,Otro,Clinton campaign,,,hacked,5000000,1,government,,,2017,13,,,5000000,Tech Crunch,
http://newsroom.questdiagnostics.com/2016-12-12-Quest-Diagnostics-Provides-Notice-of-Data-Security-Incident#assets_129,,,4000,Otro,Quest Diagnostics,,,hacked,34000,1,healthcare,,,2017,13,,,34000,Newsroom,"Nov. The stolen data contained names, DOBs, lab results and some telephone numbers."
http://venturebeat.com/2016/08/02/hackers-break-into-telegram-revealing-15-million-users-phone-numbers/,,,1,Otro,Telegram,,,hacked,15000000,1,tech,,,2017,13,Instant messaging service,,15000000,Venture Beat,"Despite Telegram's claims of super security, they've been hacked by a group called Rocket Kitten."
http://www.cbc.ca/beta/news/technology/bell-data-breach-customer-names-phone-numbers-emails-leak-1.4116608,,,1,Otro,Bell,,,hacked,1900000,1,telecoms,,,2017,13,,,1900000,CBC,Somebody claiming to be behind the attack has threatened Bell with more leaks if they don't cooporate.
http://www.threemediacentre.co.uk/news/2017/handsetfraud-update.aspx,,,20,Otro,Three,,,hacked,200000,1,telecoms,,,2017,13,Three mobile company in the UK,,200000,Three,"Hackers broke into Three's customer database with the intention of fraudulently ordering handsets to sell on. They stole personal details, but no financial records or passwords were stored on the hacked system."
http://www.bbc.co.uk/news/technology-38350987,,,1,Otro,PayAsUGym,,,hacked,300000,1,web,,,2017,13,,,300000,BBC News,Dec. Fitness website hacked & email address published online.
https://www.cnet.com/news/yahoo-says-forged-cookie-attack-accessed-about-32m-accounts/,,,4000,Otro,Yahoo,,,hacked,32000000,1,web,,,2017,13,,,32000000,CNET,User accounts have been hacked using forged cookies to log in without a password over a 2 year period.
http://www.digitaltrends.com/computing/clixsense-hacked/,,,50000,Otro,ClixSense,,,hacked,6600000,1,web,,,2017,13,,,6600000,Digital trends,"Sept. The information stolen contains usernames, passwords, home addresses, payment histories, and other banking details."
https://www.hackread.com/zomato-hacked-17-million-accounts-sold-on-dark-web/,,,4000,Otro,Zomato,,,hacked,17000000,1,web,,,2017,13,Restaurants & events,,17000000,HackRead,The hacker is selling the stolen dataset for around $1000.
https://www.neowin.net/news/microsoft-owned-linkedin-is-sending-emails-to-users-about-a-lyndacom-data-breach,,,1,Otro,Lynda.com,,,hacked,9500000,1,web,,,2017,13,owned by LinkedIn,,9500000,Neowin,"Hackers breached a database that held records of contact info and courses viewed. No official statement yet on how many records were actually stolen, and no evidence yet of them having been published anywhere."
http://www.nytimes.com/2016/07/29/world/asia/north-korea-hacking-interpark.html,,,20,Otro,Interpark,,,hacked,10000000,1,web,,,2017,13,,,10000000,NY Times,July. South Korean police are blaming North Korea for stealing data in an attempt to obtain foreign currency.
https://techcrunch.com/2016/10/20/weebly-hacked-43-million-credentials-stolen/,,,4000,Otro,Weebly,,,hacked,43000000,1,web,,,2017,13,,,43000000,Tech Crunch,"Feb. Usernames, passwords and IP addresses stolen, although passwords secured with bcrypt."
http://www.zdnet.com/article/font-sharing-site-dafont-hacked-thousands-of-accounts-stolen/,,,4000,Otro,DaFont,,,hacked,700000,1,web,,,2017,13,Font sharing site,,700000,ZD Net,"May. Apparently the hacker found out others were selling the site's database, so he decided to get in on the action himself."
http://www.zdnet.com/article/dailymotion-hack-exposes-millions-of-accounts/,,,1,Otro,Dailymotion,,,hacked,85200000,1,web,,,2017,13,video sharing site,,85200000,ZDNet,"85.2m email addresses extracted, but only 18.3m had associated passwords."
http://www.zdnet.com/article/adultfriendfinder-network-hack-exposes-secrets-of-412-million-users/,https://www.leakedsource.com/blog/friendfinder,,1,Otro,Friend Finder Network,,,hacked,412000000,1,web,,,2017,13,"Parent company of Adult Friend Finder , Cams.com and Penthouse.com",,412000000,ZDNet / LeakedSource,"Usernames, email addresses, passwords for sites including Adult Friend Finder and Penthouse.com. Passwords encrypted, but LeakedSource claims to be able to crack 99% of them."
https://www.bleepingcomputer.com/news/security/paypal-says-1-6-million-customer-details-stolen-in-breach-at-canadian-subsidiary/,,,4000,Otro,TIO Networks,,,hacked,1600000,1,financial,,,2017,14,Owned by Paypal,,1600000,Bleeping Computer,The company has not revealed what type of information was stolen.
https://www.lowyat.net/2017/146339/46-2-million-mobile-phone-numbers-leaked-from-2014-data-breach/,,,4000,Otro,Malaysian medical practitioners,,,hacked,81309,1,healthcare,,,2017,14,,,81309,LowYat,"Oct. Databases belonging to the Malaysian Medical Council (MMC), the Malaysian Medical Association (MMA), and the Malaysian Dental Association (MDA) have been leaked."
https://www.lowyat.net/2017/146339/46-2-million-mobile-phone-numbers-leaked-from-2014-data-breach/,,,4000,Otro,Malaysian telcos & MVNOs,,,hacked,46200000,1,telecoms,,,2017,14,,,46200000,LowYat,"Oct. Data from numerous Malaysian telco & MVNO providers, including Celcom, Digi, Umobile, Maxis, Friendi, Merchantrade Asia, Tunetalk, Redtone, XOX, Altel, PLDT & EnablingAsia has been leaked."
https://motherboard.vice.com/en_us/article/pgkp57/a-teen-hacker-is-targeting-russian-sites-as-revenge-for-the-mh17-crash,,,4000,Otro,KM.ru,,,hacked,1500000,1,web,,,2017,14,News site and email provider,,1500000,Motherboard,"A teen hacker has randomly hacked several Russian websites. In a statement, he claims the hack was revenge for the MH17 crash. The companies affected have not commented, however Troy Hunt, a security researcher, has confirmed its legit. Nival and KM.ru were both hacked."
https://motherboard.vice.com/en_us/article/pgkp57/a-teen-hacker-is-targeting-russian-sites-as-revenge-for-the-mh17-crash,,,4000,Otro,Nival,,,hacked,1500000,1,web,,,2017,14,Videogame maker,,1500000,Motherboard,"A teen hacker has randomly hacked several Russian websites. In a statement, he claims the hack was revenge for the MH17 crash. The companies affected have not commented, however Troy Hunt, a security researcher, has confirmed its legit. Nival and KM.ru were both hacked."
https://thehackernews.com/2017/09/viacom-amazon-server.html,,,4000,Otro,Viacom,,,hacked,3000000,1,web,,,2017,14,,,3000000,The Hacker News,A misconfigured Amazon Web Server S3 cloud storage bucket was left wide open and public facing.
https://www.theverge.com/2017/9/1/16244304/instagram-hack-api-bug-doxagram-selena-gomez,,,1,Otro,Instagram,,,hacked,6000000,1,web,,,2017,14,,,6000000,The Verge,"A bug exposed user's contact information. Instagram initially said it affected only verified accounts, but has now admitted non-verified users were also affected. Instagram hasn't confirmed numbers, but hackers say they have info from 6m accounts."
https://www.theguardian.com/technology/2018/mar/30/hackers-steal-data-150m-myfitnesspal-app-users-under-armour,,,1,MyFitnessPal,MyFitnessPal,,,hacked,150000000,1,app,,,2018,14,UnderArmour,,150000000,Guardian,"Feb. Usernames, email addresses, and hashed user passwords were stolen."
https://www.nytimes.com/2018/04/01/technology/saks-lord-taylor-credit-cards.html,,,300,Otro,Saks and Lord & Taylor,,,hacked,5000000,1,retail,,,2018,14,Both owned by Hudson's Bay Company,,5000000,NYTimes,"Apr. A known ring of cybercriminals implanted software into store cash registers, siphoning off payment card details. The company has not divulged how many accounts have been affected, but the research firm that identified the breach believe 5million records may have been stolen."
https://www.usnews.com/news/business/articles/2018-03-20/orbitz-legacy-travel-booking-platform-likely-hacked,,,300,Otro,Orbitz,,,hacked,880000,1,web,,,2018,14,,,880000,US News,"Mar. An old version of the Orbitz website was hacked, exposing personal details and payment card info. Orbitz is now owned by Expedia."
http://money.cnn.com/2004/06/23/technology/aol_spam/,http://www.msnbc.msn.com/id/8985989/#.UFcN8RgUwaA,,1,Otro,AOL,,,inside job,92000000,1,web,,,2004,0,American Online,,92000000,CNN,A former America Online software engineer stole 92 million screen names and e-mail addresses and sold them to spammers who sent out up to 7 billion unsolicited e-mails.
http://www.idtheftcenter.org/artman2/publish/lib_survey/ITRC_2008_Breach_List.shtml,,,300,Otro,Countrywide Financial Corp,,,inside job,2600000,1,financial,,,2006,2,Mortgage financer,,2600000,ITRC,
http://www.pcworld.com/article/135117/article.html,,,300,Otro,Fidelity National Information Services,,,inside job,8500000,1,financial,,,2007,3,"Employee sold customer information to a data broker, including names, addresses, birth dates, bank account and credit card information.",,8500000,PCWorld,
http://www.idtheftcenter.org/artman2/publish/lib_survey/ITRC_2008_Breach_List.shtml,,,20,Otro,Texas Lottery,,,inside job,90000,1,government,,,2007,3,,,89000,ITRC,"Data on more than 89,000 lottery winners (including names, Social Security numbers, addresses and prize amounts )were taken from the agency without permission by a former computer analyst who copied the password-free data. The employee added he wanted the information ""for possible future reference as a programmer at other state agencies."""
