http://usatoday30.usatoday.com/tech/news/computersecurity/2007-12-30-data_n.htm,,,1,Otro,Dai Nippon Printing,,,inside job,8600000,1,retail,,,2007,3,Japanese printing company,,8637405,USA Today,"A former contractor of Dai Nippon Printing Company in Tokyo, Japan stole 8.6 million records containing the personal data of customers of 43 of the company's clients."
http://www.datalossdb.org,http://english.donga.com/srv/service.php3?biid=2008090631088,,20,Otro,GS Caltex,,,inside job,11100000,1,energy,,,2008,4,Private oil company,,11100000,Data Loss Database,"Two multimedia discs containing the names, social security numbers, addresses, cell phone numbers, email addresses and workplaces of Korean customers sorted by age were stolen. They were found by an office worker in a backstreet’s trash pile in Seoul. Experts say a GS Caltex employee likely stole the information for personal purposes given there were no signs of hacking."
http://www.forbes.com/sites/andygreenberg/2010/10/22/wikileaks-reveals-the-biggest-classified-data-breach-in-history/,,,20,Otro,Classified Iraq War documents,,,inside job,400000,1,government,,,2010,6,,,392000,Forbes,Wikileaks
http://wikileaks.org/cablegate.html,,,50000,Otro,Embassy Cables,,,inside job,300000,1,government,,,2010,6,"Confidential communications between 274 embassies in countries throughout the world and the State Department in Washington DC, between 1966-2010.",,251000,Wikileaks,Wikileaks
http://latimesblogs.latimes.com/money_co/2011/09/man-convicted-in-huge-countrywide-data-theft-gets-8-months-in-prison.html,,,20,Otro,Countrywide Financial Corp,,,inside job,2500000,1,financial,,,2011,7,Employee convicted of downloading millions of borrower files and selling the information to other loan officers.,,2500000,LATimes,mortgage lender
http://www.idtheftcenter.org/artman2/publish/lib_survey/ITRC_2008_Breach_List.shtml,,,20,Otro,New York State Electric & Gas,,,inside job,1800000,1,energy,,,2012,8,,,1800000,ITRC,An employee from a software consulting firm was allowed unauthorized access to the company’s databases.
http://bits.blogs.nytimes.com/2013/10/24/senator-intensifies-probe-of-data-brokers/?_php=true&_type=blogs&_r=0,http://www.experianplc.com/news/company-news/2014/04-04-2014.aspx,,20,Otro,Court Ventures,,,inside job,200000000,1,financial,,,2012,8,Experian,,200000000,NY Times / Experian,"A Vietnamese identity theft service was sold personal records, including Social Security numbers, credit card data and bank account information, by Court Ventures, a company now owned by data brokerage firm Experian."
http://www.thestate.com/2012/04/20/2241321/personal-information-of-more-than.html#.UFpUVqRYtmg,http://www.hhs.gov/ocr/privacy/hipaa/administrative/breachnotificationrule/breachtool.html,,4000,Otro,South Carolina Government,,,inside job,200000,1,healthcare,,,2012,8,South Carolina Department of Health and Human Services,,6400000,US Gov,"A man was charged with five counts of violating medical confidentiality laws and one count of disclosure of confidential information after he gained access to personal information for more than 228,000 Medicaid beneficiaries."
https://www.wikileaks.org/plusd/about/,,,300,Otro,Kissinger Cables,,,inside job,1700000,1,government,,,2013,9,"More than 1.7 million US diplomatic records for the period 1973 to 1976, including intelligence reports and congressional correspondence.",,1700000,Wikileaks,Wikileaks
http://www.securityweek.com/20-million-people-fall-victim-south-korea-data-leak,,,50000,Otro,Korea Credit Bureau,,,inside job,20000000,1,financial,,,2014,10,,,20000000,Security Week,
http://www.bbc.co.uk/news/world-europe-36645519,,,50000,Otro,Mutuelle Generale de la Police,,,inside job,112000,1,healthcare,,,2016,12,French police health insurance,,112000,BBC News,Files uploaded to Google Drive by a 'malicious' employee. Data included home addresses. The leak came two weeks after a French police officer was murdered by ISIS-inspired attack.
http://www.nbcnews.com/id/7561268/,,,20,Otro,Ameritrade Inc.,,,lost / stolen device or media,200000,1,financial,,,2005,1,Computer backup tape containing personal information was lost.,,200000,NBC,online broker
http://gcn.com/Articles/2009/02/02/VA-data-breach-suit-settlement.aspx,,,20,Otro,US Dept of Vet Affairs,,,lost / stolen device or media,26500000,1,"government, military",,,2006,2,,,26500000,GCN,The Veterans Affairs Department agreed to pay $20 million to settle a class action lawsuit over the loss of a laptop. The department originally took three weeks to report the theft. The laptop was recovered with the data apparently intact a month after it was reported stolen. But it is impossible to say with absolute certainty that the data was not accessed and copied.
http://www.datalossdb.org,http://www.informationweek.com/security/attacks/t-mobile-lost-17-million-subscribers-per/210700232,,1,Otro,"T-Mobile, Deutsche Telecom",,,lost / stolen device or media,17000000,1,telecoms,,,2006,2,,,17000000,Data Loss Database,"Thieves got their hands on a storage device with the data, which included the names, addresses, cell phone numbers, and some birth dates and e-mail addresses for high-profile German citizens. The company said the records did not contain bank details, credit card numbers, or call data."
http://news.bbc.co.uk/1/hi/uk_politics/7147715.stm,,,20,Otro,Driving Standards Agency,,,lost / stolen device or media,3000000,1,government,,,2007,3,,,3000000,BBC News,"Hard disk with details of candidates for the driving theory test was lost in a premises in Iowa by subcontractors. Only names, addresses and phone numbers."
http://news.bbc.co.uk/1/hi/uk_politics/7147715.stm,,,20,Otro,"Driving Standards Agency,",,,lost / stolen device or media,3000000,1,government,,,2007,3,Details of candidates for the driving theory test were on a hard drive that went missing in the US.,,3000000,BBC News,
http://news.bbc.co.uk/2/hi/uk_news/7103911.stm,,,1,Otro,UK Revenue & Customs,,,lost / stolen device or media,25000000,1,government,,,2007,3,HMRC,,25000000,BBC News,A set of discs containing confidential details of 25 million child benefit recipients was lost.
http://www.computerweekly.com/news/2240104003/Hackney-NHS-trust-encrypts-IT-equipment-following-loss-of-child-data,,,20,Otro,City and Hackney Teaching Primary Care Trust,,,lost / stolen device or media,160000,1,government,,,2007,3,,,160000,Computer Weekly,Heavily encrypted disks containing details of children are lost by couriers.
http://www.pcworld.com/article/137865/article.html,,,20,Otro,Gap Inc,,,lost / stolen device or media,800000,1,retail,,,2007,3,,,800000,PC World,"Stolen laptop which contained social security numbers, data on people who applied for positions at Gap stores, including Banana Republic and Old Navy, between July 2006 and June 2007."
http://www.idtheftcenter.org/artman2/publish/lib_survey/ITRC_2008_Breach_List.shtml,,,300,Otro,University of Miami,,,lost / stolen device or media,2100000,1,academic,,,2008,4,,,2100000,ITRC,"Thieves stole a briefcase containing data tapes out of a vehicle used by a private off-site storage company. Anyone who had been a patient of a University of Miami physician or visited a UM facility since 1999 is likely included on the tapes. The data included names, addresses, Social Security numbers and health information. 47,000 of these records may have included credit card or other financial information regarding bill payment."
http://www.idtheftcenter.org/artman2/publish/lib_survey/ITRC_2008_Breach_List.shtml,http://www.sfgate.com/bayarea/article/Stanford-employees-data-on-stolen-laptop-3281185.php,,20,Otro,Stanford University,,,lost / stolen device or media,72000,1,academic,,,2008,4,,,72000,ITRC,"Tens of thousands of past and current Stanford University employees had personal information - including their dates of birth, Social Security numbers and home addresses - stored on the hard drive of a stolen university laptop."
http://www.wctv.tv/news/headlines/28132494.html?storySection=comments,,,1,Otro,BNY Mellon Shareowner Services,,,lost / stolen device or media,12500000,1,financial,,,2008,4,Wealth management,,12500000,ITRC,"A back-up tape, containing over 12 million customers records were lost."
http://news.bbc.co.uk/1/hi/england/gloucestershire/7639006.stm,,,20,Otro,Service Personnel and Veterans Agency (UK),,,lost / stolen device or media,50000,1,government,,,2008,4,,,50500,BBC News,Stolen USBs containing personal information about private lives of staff.
http://en.wikipedia.org/wiki/List_of_UK_government_data_losses,,,20,Otro,UK Home Office,,,lost / stolen device or media,84000,1,government,,,2008,4,,,84000,Wikipedia,"PA Consulting lost an unencrypted memory stick containing details of high risk, prolific and other offenders."
http://www.governmentsecurity.org/latest-security-news/laptop-theft-exposes-private-info-of-avmed-health-plansaapos-customers.html,http://www.hhs.gov/ocr/privacy/hipaa/administrative/breachnotificationrule/breachtool.html,,20,Otro,"AvMed, Inc.",,,lost / stolen device or media,1200000,1,healthcare,,,2009,5,,,1220000,US Gov,"Two company laptops containing names, addresses, dates of birth, Social Security numbers and health-related information."
https://www.databreaches.net/puerto-rico-dept-of-health-reports-breach-affecting-400000-triple-s-salud-fined-100k/,,,4000,Otro,"Triple-S Salud, Inc.",,,lost / stolen device or media,400000,1,healthcare,,,2010,6,Puerto-Rican health insurance company,,398000,Data Breaches,
http://www.idtheftcenter.org/artman2/publish/lib_survey/ITRC_2008_Breach_List.shtml,,,50000,Otro,"South Shore Hospital, Massachusetts",,,lost / stolen device or media,800000,1,healthcare,,,2010,6,,,800000,ITRC,"South Shore Hospital hired a contractor to destroy files no longer in use and lost the shipment. The back-up computer files possibly contained names, addresses, phone numbers, dates of birth, Social Security numbers, driver’s license numbers, medical record numbers, patient numbers, health plan information, protected health information including diagnoses and treatments. As well as bank account and credit card numbers for some. Patients, employees, physicians, volunteers, donors, vendors and other business partners were effected."
http://www.hhs.gov/ocr/privacy/hipaa/administrative/breachnotificationrule/breachtool.html,,,4000,Otro,New York City Health & Hospitals Corp.,,,lost / stolen device or media,1700000,1,healthcare,,,2010,6,New York City Health & Hospitals Corporation's North Bronx Healthcare Network,,1700000,US Gov,
http://www.phiprivacy.net/?tag=lincoln-medical-and-mental-health-center,http://www.hhs.gov/ocr/privacy/hipaa/administrative/breachnotificationrule/breachtool.html,,4000,Otro,Lincoln Medical & Mental Health Center,,,lost / stolen device or media,130000,1,healthcare,,,2010,6,,,130495,US Gov,"130,495 patients lost their protected health information after seven CDs were lost in transit."
http://www.healthcareinfosecurity.com/chicago-breach-affects-180000-a-2496,http://www.hhs.gov/ocr/privacy/hipaa/administrative/breachnotificationrule/breachtool.html,,4000,Otro,"Emergency Healthcare Physicians, Ltd.",,,lost / stolen device or media,180000,1,healthcare,,,2010,6,A Chicago emergency physician group,,180111,US Gov,"The stolen portable hard drive is believed to have contained records from 2003 to 2006 that included patient names, addressees, phone numbers, birth dates, Social Security numbers, and, in some cases, drivers' license numbers."
http://www.databreaches.net/?p=12611,http://www.hhs.gov/ocr/privacy/hipaa/administrative/breachnotificationrule/breachtool.html,,20,Otro,Colorado government,,,lost / stolen device or media,100000,1,healthcare,,,2010,6,Department of Health Care Policy & Financing,,105470,US Gov,
http://www.idtheftcenter.org/artman2/publish/lib_survey/ITRC_2008_Breach_List.shtml,http://www.hhs.gov/ocr/privacy/hipaa/administrative/breachnotificationrule/breachtool.html,,300,Otro,Health Net - IBM,,,lost / stolen device or media,1900000,1,healthcare,,,2011,7,Data lost from HN servers managed by IBM,,1900000,ITRC,"Several server drives, containing personal information of former and current employees, went missing."
http://www.goupstate.com/news/20110527/spartanburg-regional-patients-affected-by-computer-breach,http://www.hhs.gov/ocr/privacy/hipaa/administrative/breachnotificationrule/breachtool.html,,4000,Otro,Spartanburg Regional Healthcare System,,,lost / stolen device or media,400000,1,healthcare,,,2011,7,,,400000,US Gov,"The stolen computer contained a password-protected file with Social Security numbers as well as names, addresses, dates of birth and medical billing codes."
http://www.simplysecurity.com/2011/11/30/sutter-health-sued-for-1-billion-following-data-breach/,http://www.hhs.gov/ocr/privacy/hipaa/administrative/breachnotificationrule/breachtool.html,,20,Otro,Sutter Medical Foundation,,,lost / stolen device or media,4200000,1,healthcare,,,2011,7,,,4243434,US Gov,"A password protected but unencrypted company computer was stolen. The compromised database contained names, addresses, dates of birth, phone numbers, email addresses, medical record numbers and the name of each patient's health insurance plan. No medical records were stored on the computer."
http://databreachinvestigation.blogspot.com/2011/04/thief-gets-away-with-eisenhower-medical.html,http://www.hhs.gov/ocr/privacy/hipaa/administrative/breachnotificationrule/breachtool.html,,4000,Otro,Eisenhower Medical Center,,,lost / stolen device or media,500000,1,healthcare,,,2011,7,California hospital,,514330,US Gov,"Stolen computer contained data listing patients' names, ages, dates of birth, medical record numbers and the last four digits of their social security numbers."
http://www.mhs.net/pdf/release071112.pdf,http://www.hhs.gov/ocr/privacy/hipaa/administrative/breachnotificationrule/breachtool.html,,20,Otro,Memorial Healthcare System,,,lost / stolen device or media,100000,1,healthcare,,,2011,7,Florida,,102153,US Gov,"An employee of an affiliated physician’s office may have improperly accessed patient information through a web portal used by physicians who provide care and treatment at MHS. Specifically, patients’ names, dates of birth, and Social Security numbers."
http://zerosecurity.org/technews/past-three-years-over-21m-medical-record-breaches/,http://www.hhs.gov/ocr/privacy/hipaa/administrative/breachnotificationrule/breachtool.html,,4000,Otro,Nemours Foundation,,,lost / stolen device or media,1100000,1,healthcare,,,2011,7,US children's hospitals,,1055489,US Gov,A health care organization that runs children’s hospitals reported the loss of 1.05 million records when data backup tapes were lost.
http://www.reuters.com/article/us-data-breach-texas-idUSTRE78S5JG20110929,,,4000,Otro,Tricare,,,lost / stolen device or media,4900000,1,"military, healthcare",,,2011,7,Healthcare service for US Military,,4901432,ITRC,"The information for some 4.6 million active and retired military personnel, as well as their families, was on back up-tapes from an electronic health care record used to capture and preserve patient data from 1992 through September 7 2011."
http://www.idtheftcenter.org/artman2/publish/lib_survey/ITRC_2008_Breach_List.shtml,http://articles.businessinsider.com/2012-04-03/news/31279254_1_major-data-breach-identity-theft-office-of-privacy-protection,,20,Otro,California Department of Child Support Services,,,lost / stolen device or media,800000,1,government,,,2012,8,,,800000,ITRC,California child support records were lost in transit during a disaster preparedness exercise.
http://www.hhs.gov/ocr/privacy/hipaa/administrative/breachnotificationrule/breachtool.html,,,4000,Otro,Emory Healthcare,,,lost / stolen device or media,300000,1,healthcare,,,2012,8,hospital system in Atlanta,,315000,US Gov,"The company 'misplaced' 10 discs containing sensitive information, including social security numbers."
http://www.privacyrights.org/data-breach,,,20,Otro,Florida Department of Juvenile Justice,,,lost / stolen device or media,100000,1,government,,,2013,9,,,100000,Privacy Rights,"Three computers were stolen that contained both youth and employee records was reported stolen on January 2, 2013.  Over 100,000 records were on the device and may have been exposed."
http://www.privacyrights.org/data-breach,,,20,Otro,Florida Courts,,,lost / stolen device or media,100000,1,government,,,2013,9,Florida Department of Juvenile Justice,,100000,Privacy Rights,
http://www.privacyrights.org/data-breach,,,4000,Otro,"Crescent Health Inc., Walgreens",,,lost / stolen device or media,100000,1,healthcare,,,2013,9,,,100000,Privacy Rights,"Names, Social Security numbers, health insurance identification numbers, health insurance information, dates of birth, diagnoses, other medical information, disability codes, addresses, and phone numbers may have been exposed via a laptop theft."
http://www.scmp.com/news/hong-kong/politics/article/2082566/laptops-containing-37-million-hong-kong-voters-data-stolen,,,20,Otro,Hong Kong Registration & Electoral Office,,,lost / stolen device or media,3700000,1,government,,,2017,13,,,3700000,SCMP,"""the personal information of the city’s 3.7 million voters was possibly compromised after the Registration and Electoral Office reported two laptop computers went missing at its backup venue for the chief executive election."""
http://abcnews.go.com/Technology/story?id=2160425&page=1#.UFcROxgUwaA,,,20,Otro,Automatic Data Processing,,,poor security,130000,1,financial,,,2005,1,"Business outsourcing, payrolls, benefits",,125000,ABC,
http://www.databreaches.net/?p=19198,http://www.hhs.gov/ocr/privacy/hipaa/administrative/breachnotificationrule/breachtool.html,,20,Otro,Accendo Insurance Co.,,,poor security,180000,1,healthcare,,,2011,7,,,175350,US Gov,"Mismailed letters which allowed some lines of sensitive information (medication name, date of birth, and member ID) to be visible through the envelope window. The mailings were addressed correctly and, to the knowledge of the company, were received by the intended recipients."
http://news.iu.edu/releases/iu/2014/02/data-exposure-disclosure.shtml,http://www.usatoday.com/story/news/nation/2014/02/26/indiana-university-data-breach/5830685/,,20,Otro,Indiana University,,,poor security,150000,1,academic,,,2013,9,,,146000,Indiana University,Students who attended the university between 2011 and 2014 may have had their data exposed after it was stored on an unprotected site. The data was accessed by three webcrawlers but there is not evidence it was accessed by any unauthorized individuals.
http://www.theguardian.com/technology/2014/aug/05/mozilla-leak-developer-email-addresses-passwords-firefox,,,20,Otro,Mozilla,,,poor security,800000,1,web,,,2014,10,,,76000,The Guardian,
http://blog.uber.com/2-27-15,,,1,Otro,Uber,,,poor security,50000,1,tech,,,2015,11,,,50000,Uber,"Occured Sep 2014. Revealed Feb 2015. Names & license plates of 50,000 driver partners."
http://www.csoonline.com/article/3017171/security/database-leak-exposes-3-3-million-hello-kitty-fans.html,,,20,Otro,Sanrio,,,poor security,3300000,1,web,,,2015,11,Hello Kitty and other franchises,,3300000,CSO Online,"Security researcher was able to access a database of 3.3m of Sanrio's Sanriotown.com accounts, with links to other Sanrio Hello Kitty portals."
https://threatpost.com/leaky-rootsweb-server-exposes-some-ancestry-com-user-data/129248/,,,4000,Otro,RootsWeb,,,poor security,300000,1,web,,,2015,11,,,300000,Threat Post,"Nov. Ancestry.com's community-driven site RootsWeb was exposed after passwords, email addresses and usernames were leaked from the server."
http://uk.reuters.com/article/us-usa-voters-breach-idUKKBN0UB1E020151229,https://www.upguard.com/breaches/the-rnc-files,,20,Otro,Deep Root Analytics,,,poor security,198000000,1,web,,,2015,11,,,198000000,"Reuters, UpGuard",A database of 198 million US voters has been exposed as a result of incorrect configuration.
https://thestack.com/security/2016/06/29/2-million-person-terror-database-leaked-online/,,,300,Otro,World Check,,,poor security,2200000,1,media,,,2016,12,Run by Thompson Reuters,,2200000,The Stack,"2014 version of World-Check, a database of suspected terrorists and criminals, leaked online. It's unclear what data the records include."
https://www.databreaches.net/waterly-app-potentially-exposed-up-to-1-million-israelis-details-researcher/,,,300,Otro,Waterly,,,poor security,1000000,1,app,,,2017,14,App for paying water bills,,1000000,Data Breaches,Jan 2017. Israel-based app contained a vulnerability in the sign-in process that could potentially expose user account details. The problem was fixed within 2 weeks of being identifiied.
https://thehackernews.com/2017/09/hacker-track-car.html,,,4000,Otro,SVR Tracking,,,poor security,540000,1,app,,,2017,14,Vehicle tracking,,540000,The Hacker News,"The leaked passwords were stored using SHA-1, a weak 20yr old hash program."
http://www.zdnet.com/article/popular-virtual-keyboard-leaks-31-million-user-data/,,,4000,Otro,Al.type,,,poor security,31000000,1,app,,,2017,14,,,31000000,ZDNet,Dec. The app's developer failed to secure the database server.
https://www.theguardian.com/technology/2017/aug/30/spambot-leaks-700m-email-addresses-huge-data-breach-passwords,,,4000,Otro,Spambot,,,poor security,711000000,1,web,,,2017,14,,,711000000,The Guardian,"A misconfigured spambot has leaked over 7m records, although many of them are likely to be fake or repeated accounts."
https://www.reuters.com/article/us-twitter-passwords/twitter-urges-all-users-to-change-passwords-after-glitch-idUSKBN1I42JG,,,1,Otro,Twitter,,,poor security,330000000,1,app,,,2018,14,,,330000000,Reuters,"May. A glitch caused some passwords to be stored in readable text, visible on the internal computer system."
http://www.zdnet.com/article/another-data-leak-hits-india-aadhaar-biometric-database/,,,4000,Otro,Aadhaar,,,poor security,1100000000,1,government,,,2018,14,India's national government ID database,,1100000000,ZDNet,Mar. A security researcher discovered a system vulnerability which means that anybody could download private info on all Aadhaar users. The govt. department that deals with the database has denied the breach.
https://thenextweb.com/security/2018/03/14/jewelry-site-accidentally-leaks-personal-details-plaintext-passwords-1-3m-users/,,,4000,Otro,MBM Company,,,poor security,1300000,1,retail,,,2018,14,Limogés Jewellery,,1300000,NextWeb,"Mar. Negligent storage of a customer database exposed full postal addresses, email addresses, IP addresses and plain-text passwords."
https://krebsonsecurity.com/2018/04/panerabread-com-leaks-millions-of-customer-records/,https://medium.com/@djhoulihan/no-panera-bread-doesnt-take-security-seriously-bf078027f815,,20,Otro,Panerabread,,,poor security,37000000,1,retail,,,2018,14,,,37000000,"Krebsonsecurity, Medium","Customer records were available via the site for at least 8 months. Panerabread were alerted to the leak in Aug 2017, but didn't pull the site until Apr 2018. Panerabread claims 10k records were leaked, but security researchers put the figure at over 37 million."
http://www.usatoday.com/story/cybertruth/2013/09/26/lexisnexis-dunn--bradstreet-altegrity-hacked/2878769/,http://www.reuters.com/article/2013/09/26/us-cyberattacks-databrokers-idUSBRE98P03220130926,http://www.bbc.co.uk/news/technology-24284277,300,Otro,"D&B, Altegrity",,,hacked,1000000,1,tech,,,2014,10,,,1000000,USA Today; Reuters; BBC News,"Hackers stole millions of social security numbers from large US data brokers Dun & Bradstreet Corp and Kroll Background America Inc, owned by Altegrity. Correction 7 Jan 2015: we previously stated that records were stolen from LexisNexis. LexisNexis conducted a thorough investigation of the malware intrusion and found no evidence that the malware accessed or stole any customer or consumer data."
http://www.bbc.co.uk/news/uk-34784980,http://www.bbc.co.uk/news/uk-34611857,http://www.theguardian.com/business/2015/oct/22/talktalk-customer-data-hackers-website-credit-card-details-attack,20,Otro,TalkTalk,,,hacked,160000,1,web,,,2015,11,Telecoms provider,,157000,BBC News,"157k customers had personal details stolen, including 15,600 account numbers."
,,,,Otro,,Show this item in the viz?,,,"(use 3m, 4m, 5m or 10m to approximate unknown figures)",1,,,,,,,,,,Elaboration if there's an interesting story or detail behind it
http://techcrunch.com/2006/08/06/aol-proudly-releases-massive-amounts-of-user-search-data/,,,1,Otro,AOL,,,accidentally published,20000000,1,web,,,2006,2,American Online,y,20000000,Tech Crunch,"Durp. AOL VOLUNTARILY released search data for roughly 20 million web queries from 658,000 anonymized users of the service. No one is quite sure why."
http://infowatch.com/node/1289,,,20,Otro,Norwegian Tax Authorities,,,accidentally published,4000000,1,government,,,2008,4,,y,3950000,Info Watch,"""Tax authorities said they had accidentally sent CD-ROMs filled with the 2006 tax returns of nearly four million people living in Norway, a country of 
just 4.6 million inhabitants, to the editorial staff at national 
newspapers, radios and television stations."""
http://www.idtheftcenter.org/artman2/publish/lib_survey/ITRC_2008_Breach_List.shtml,http://www.journal-news.net/page/content.detail/id/511806.html?nav=5006,,20,Otro,Jefferson County,,,accidentally published,1600000,1,government,,,2008,4,"West Virginia, US",y,1600000,ITRC,"""Jefferson County Clerk Jennifer Maghan said she unveiled a new online search tool that enabled residents and business professionals to access nearly 1.6 million documents that are stored in her office via their home computers"""
