1St Source Link,2Nd Source Link,3Rd Source,Data Sensitivity,Entity (grupo),Entity,Exclude,F15,Method Of Leak,No Of Records Stolen,Number of Records,Sector,Unused 1,Unused,Year,Year(2),Alternative Name,Interesting Story,Records Lost,Source Name,Story
http://www.idtheftcenter.org/artman2/publish/lib_survey/ITRC_2008_Breach_List.shtml,,,20,Otro,Yale University,,,accidentally published,40000,1,academic,,,2010,6,,,43000,ITRC,
http://www.informationweek.com/security/attacks/texas-data-breach-exposed-35-million-rec/229401489?queryText=Texas%20data%20leak,,,20,Otro,State of Texas,,,accidentally published,3500000,1,government,,,2011,7,,,3500000,Information Week,"3.5 million records were accidentally published online including people's names, mailing addresses, social security numbers, and in some cases dates of birth and driver's license numbers."
http://www.idtheftcenter.org/artman2/publish/lib_survey/ITRC_2008_Breach_List.shtml,,,1,Otro,US Army,,,accidentally published,50000,1,military,,,2011,7,,,50000,ITRC,
http://www.rawstory.com/rs/2012/04/26/texas-attorney-general-exposes-millions-of-voters-social-security-numbers/,,,20,Otro,Office of the Texas Attorney General,,,accidentally published,6500000,1,government,,,2012,8,,,6500000,Raw Story,The office of Texas Attorney General Greg Abbott mistakenly gave attorneys access to millions of Social Security numbers in a case against the state’s voter ID law
http://www.europarl.europa.eu/sides/getDoc.do?pubRef=-//EP//TEXT+WQ+E-2013-001939+0+DOC+XML+V0//EN&language=nl,http://www.flanderstoday.eu/business/nmbs-data-leak-was-breach-privacy,,20,Otro,NMBS,,,accidentally published,1500000,1,transport,,,2013,9,Belgian national railway operator,,1460000,European Parliament,"Data stored on a non-secure server, making it possible to access names, gender, DOB, email and postal address data of customers externally by means of a simple search engine query. Most of the data belong to customers in Belgium, France and the UK, including thousands of Commission and Parliament employees.  Caused, the NMBS said, by a data worker “clicking on the wrong button”."
https://www.facebook.com/notes/facebook-security/important-message-from-facebooks-white-hat-program/10151437074840766,,,1,Otro,Facebook,,,accidentally published,6000000,1,web,,,2013,9,,,6000000,Facebook,"Using the network's ""Download Your Information"" tool, some Facebook members were inadvertently sent the phone numbers or email address of Facebook friends that were otherwise private. Facebook assured users that the bug was fixed within a day, and that there is no evidence that the information was used maliciously."
http://www.theguardian.com/world/2015/mar/30/personal-details-of-world-leaders-accidentally-revealed-by-g20-organisers,,,50000,Otro,Australian Immigration Department,,,accidentally published,500000,1,government,,,2015,11,,,500000,The Guardian,"An employee of the agency inadvertently sent the passport numbers, visa details and other personal identifiers of all world leaders attending the G20 Brisbane summit to the organisers of the Asian Cup football tournament. Barack Obama, Vladimir Putin, Angela Merkel, Xi Jinping, Narendra Modi, David Cameron and many others."
http://www.shareconference.net/en/defense/personal-data-more-5-million-citizens-serbia-unlawfully-published,,,20,Otro,Privatization Agency of the Republic of Serbia,,,accidentally published,519396,1,government,,,2016,12,,,5190396,Share Conference,A text file with personal data and financial documents were made publically available on their website.
http://www.abc.net.au/news/2016-10-28/red-cross-blood-service-admits-to-data-breach/7974036,,,4000,Otro,Red Cross Blood Service,,,accidentally published,550000,1,healthcare,,,2017,13,,,550000,ABC News,Info leaked includes data about 'at risk sexual behaviours'
https://betanews.com/2017/03/06/river-city-media-spam-database-leak/,,,20,Otro,River City Media,,,accidentally published,700000000,1,web,,,2017,13,Spam operator,,1370000000,Beta News,"A dodgy backup has allegedly resulted in over a billion leaked email addresses, plus other personal info in some cases, and has exposed RCM's business plans & operations."
https://www.theguardian.com/world/2018/jan/04/india-national-id-database-data-leak-bought-online-aadhaar,,,300,Otro,Aadhaar,,,accidentally published,1000000000,1,government,,,2017,14,,,1000000000,Guardian,"Nov. The personal information of more than a billion Indians stored in the world’s largest biometric database can be bought online for less than £6, according to an investigation by an Indian newspaper. The reporter who broke the story has been named in a criminal complaint filed by government agency responsible for the data."
https://www.theguardian.com/technology/2017/aug/30/spambot-leaks-700m-email-addresses-huge-data-breach-passwords,,,300,Otro,CEX,,,accidentally published,2000000,1,retail,,,2017,14,,,2000000,The Guardian,"A misconfigured spambot leaked full contact info & financial details, although the newest financial data dates to 2009."
http://www.wired.com/threatlevel/2008/07/ameritrade-hack/,,,1,Otro,TD Ameritrade,,,hacked,6300000,1,financial,,,2007,3,US online broker,,6300000,Wired,TD Ameritrade settled a class action lawsuit to compensate as many as 6.3 million TD Ameritrade customers whose data was stolen by hackers costing the Nebraska online brokerage firm less than $2 per victim.
http://www.idtheftcenter.org/artman2/publish/lib_survey/ITRC_2008_Breach_List.shtml,,,300,Otro,Hannaford Brothers Supermarket Chain,,,hacked,4200000,1,retail,,,2007,3,"Delhaize Group: Hannaford Bros, Sweetbay, Food Lion, Bloom, Bottom Dollar, Harveys, Kash n' Karry",,4200000,ITRC,An estimated 4.2 million credit and debit card numbers were stolen.
http://www.zdnet.com/wi-fi-hack-caused-tk-maxx-security-breach-3039286991/,http://www.msnbc.msn.com/id/17871485/ns/technology_and_science-security/t/tj-maxx-theft-believed-largest-hack-ever/#.UFi-HaRYtmg,,300,Otro,TK / TJ Maxx,,,hacked,94000000,1,retail,,,2007,3,Largest retail breach to date,,94000000,ZD Net,"Hackers hacked a Minnesota store wifi network and stole data from credit and debit cards of shoppers at off-price retailers TJX, owners of nearly 2,500 stores, including T.J. Maxx and Marshalls. This case is believed to be the largest such breach of consumer information."
http://money.cnn.com/2003/02/18/technology/creditcards/,,,1,Otro,Data Processors International,,,hacked,5000000,1,financial,,,2008,4,Provides merchant account establishment and Internet based credit card payment processing services,,5000000,CNN,
http://www.theregister.co.uk/2008/12/29/rbs_worldpay_breach/,,,20,Otro,RBS Worldpay,,,hacked,1500000,1,financial,,,2008,4,the U.S. payment processing arm of The Royal Bank of Scotland Group,,1500000,The Register,"The hack primarily effected U.S. prepaid and the gift card issuing business of RBS Worldpay. Actual fraud has been committed on approximately 100 cards.  Certain personal information of approximately 1.5 million cardholders and other individuals may have been affected and, of this group, Social Security numbers of 1.1 million people may have been accessed."
http://news.bbc.co.uk/2/hi/americas/7395295.stm,http://www.geek.com/articles/news/government-servers-in-chile-hacked-6-million-personal-records-made-public-20080514/,,1,Otro,Chile Ministry Of Education,,,hacked,6000000,1,government,,,2008,4,,,6000000,BBC News,A computer hacker in Chile published confidential records belonging to six million people to illustrate the weakness of their security.
http://www.darkreading.com/security/perimeter-security/211201111/hacker-steals-data-on-18m-auction-customers-in-south-korea.html,,,300,Otro,Auction.co.kr,,,hacked,18000000,1,web,,,2008,4,South Korea's largest online shopping site,,18000000,Dark reading,
http://www.msnbc.msn.com/id/30645920/ns/technology_and_science-security/t/hackers-breach-uc-berkeley-computers/#.UFjFaKRYtmg,,,300,Otro,University of California Berkeley,,,hacked,160000,1,academic,,,2009,5,"details on students, alumni and others",,160000,ITRC,
http://www.computerworld.com/s/article/9175783/Network_Solutions_sites_hacked_again,http://voices.washingtonpost.com/securityfix/2009/07/network_solutions_hack_comprom.html,,300,Otro,Network Solutions,,,hacked,600000,1,tech,,,2009,5,Domain name registration business,,573000,ITRC,"A large-scale infection of WordPress-driven blogs with malicious code led to the compromise of 573,000 debit and credit cards."
http://www.idtheftcenter.org/artman2/publish/lib_survey/ITRC_2008_Breach_List.shtml,,,20,Otro,Ohio State University,,,hacked,800000,1,academic,,,2010,6,,,760000,ITRC,
http://www.idtheftcenter.org/artman2/publish/lib_survey/ITRC_2008_Breach_List.shtml,,,300,Otro,US Federal Reserve Bank of Cleveland,,,hacked,400000,1,financial,,,2010,6,,,400000,ITRC,"A Malaysian man has been charged with hacking into major U.S. corporations, including the U.S. Federal Reserve Bank of Cleveland and FedComp after U.S. Secret Service investigators found more than ""400,000 stolen credit and debit card account numbers allegedly obtained by hacking into various computer systems of other financial institutions"""
http://www.hhs.gov/ocr/privacy/hipaa/administrative/breachnotificationrule/breachtool.html,,,4000,Otro,Puerto Rico Department of Health,,,hacked,500000,1,healthcare,,,2010,6,,,515000,US Gov,"Double whammy. Two separate breaches. On September 3rd, 2010 data on 115,000 people was stolen from unauthorized access of an electronic device, on the 21st they reported an additional 400,000 records were hacked."
http://www.phiprivacy.net/?p=5743,http://www.hhs.gov/ocr/privacy/hipaa/administrative/breachnotificationrule/breachtool.html,,4000,Otro,"Ankle & foot Center of Tampa Bay, Inc.",,,hacked,160000,1,healthcare,,,2010,6,,,156000,US Gov,"The information hacked included information such as patient names, social security numbers, date of birth, home addressees, account numbers, and healthcare services and related diagnostic codes."
http://www.idtheftcenter.org/artman2/publish/lib_survey/ITRC_2008_Breach_List.shtml,,,300,Otro,Betfair,,,hacked,2300000,1,web,,,2010,6,UK gambling site,,2300000,ITRC,"Betfair waited 18 months to report the breach of their online gambling site, alarming banking institutions and security experts. Betfair's systems breach, which occurred in March and April 2010, was not uncovered until this past May, when a server crashed."
http://www.guardian.co.uk/technology/2010/dec/13/gawker-hackers-passwords-twitter-wikileaks?INTCMP=SRCH,http://www.mediaite.com/online/gawker-medias-entire-commenter-database-appears-to-have-been-hacked/,,20,Otro,Gawker.com,,,hacked,1500000,1,web,,,2010,6,US news and gossip blog network including Gawker.com Gizmodo.com Lifehacker.com,,1500000,Guardian,"Hacked. 1.5 Million usernames, emails, passwords taken."
http://www.idtheftcenter.org/artman2/publish/lib_survey/ITRC_2008_Breach_List.shtml,,,20,Otro,University of Wisconsin - Milwaukee,,,hacked,73000,1,academic,,,2011,7,,,73000,,
http://www.pcworld.com/article/229891/Citigroup_Hack_Nets_Over_200k_in_Stolen_Customer_Details.html,,,300,Otro,Citigroup,,,hacked,400000,1,financial,,,2011,7,,,360083,PC World,"Less than 1% of Citbank card holders' names, account numbers, and contact information such as e-mail addresses were stolen. Card security codes were not stolen."
http://www.computerworld.com/s/article/9216343/Sony_cuts_off_Sony_Online_Entertainment_service_after_hack,,,300,Otro,Sony Online Entertainment,,,hacked,24600000,1,gaming,,,2011,7,,,24600000,Computer World,"Hacked by LulzSec. In addition to the Sony Playstation Network breach, compromised 77 million records. More than 23,000 lost financial data, according to Sony."
http://www.pcworld.com/article/231215/lulzsec_a_short_history_of_hacking.html,,,1,Otro,Bethesda Game Studios,,,hacked,200000,1,gaming,,,2011,7,"US video game company (Elder Scrolls, Fallout 3)",,200000,PC World,"Hacking collective Lulzsec stole account information of 200,000 user."
http://www.zdnet.com/blog/gamification/sega-1-3-million-customer-records-hacked-lulzsec-promises-retribution/481,,,20,Otro,Sega,,,hacked,1300000,1,gaming,,,2011,7,,,1290755,ZD Net,"Information stolen during the hack includes names, birth dates, e-mail addresses and passwords from Sega Pass, a system for users interested in newsletters and for registering certain products."
http://news.cnet.com/8301-27080_3-20068386-245/sf-utilities-agency-warns-of-potential-breach/,,,1,Otro,San Francisco Public Utilities Commission,,,hacked,180000,1,government,,,2011,7,,,180000,CNET,
http://www.idtheftcenter.org/artman2/publish/lib_survey/ITRC_2008_Breach_List.shtml,,,20,Otro,Oregon Department of Motor Vehicles,,,hacked,1000000,1,government,,,2011,7,,,1000000,ITRC,"Sheriff's detectives arrested Tim Nuss for accessing an old Oregon Department of Motor Vehicles database. The DMV database was once sold to marketing companies, but the department stopped selling the information in the late 1990s. The sold data include the names, addresses, birth dates, gender and ages of people who registered with the DMV, but no financial information."
"http://www.pcmag.com/article2/0,2817,2390683,00.asp",,,300,Otro,US Law Enforcement,,,hacked,130000,1,government,,,2011,7,,,123461,PC World,"""AntiSec"" hackers published 2,719 social security numbers, 8,214 passwords, 15,798 birth dates, 48,182 street addresses, 1,531,628 email addresses, 106,691 phone numbers, 57 bank account numbers, 53 driver's license numbers, and eight credit card numbers of more than 70 different U.S. law enforcement agencies."
http://www.idtheftcenter.org/artman2/publish/lib_survey/ITRC_2008_Breach_List.shtml,,,20,Otro,Southern California Medical-Legal Consultants,,,hacked,300000,1,healthcare,,,2011,7,,,300000,ID theft centre,"Electronic files containing names and social security numbers of approximately 300,000 individuals who have applied for California workers’ compensation benefits had been exposed to unauthorized access."
"http://www.pcmag.com/article2/0,2817,2388200,00.asp",,,20,Otro,Washington Post,,,hacked,1300000,1,media,,,2011,7,,,1270000,PC Mag,Unknown hackers broke into The Washington Post's jobs website stealing about 1.27 million user IDs and email addresses.
http://bits.blogs.nytimes.com/2011/12/27/questions-about-motives-behind-stratfor-hack/,,,300,Otro,Stratfor,,,hacked,900000,1,military,,,2011,7,Shadowy global intelligence company,,935000,NY Times,"Hacking collective Anonymous defaced the website of Stratfor and posted a file online of the organization’s confidential client list, along with credit card details, passwords and home addresses for those clients. They released 47,680 unique e-mail addresses and 50,277 unique credit card numbers — 9,651 of which were not yet expired. Of the stolen encrypted passwords, 50% were easily crackable."
http://www.idtheftcenter.org/artman2/publish/lib_survey/ITRC_2008_Breach_List.shtml,,,300,Otro,Restaurant Depot,,,hacked,200000,1,retail,,,2011,7,"food, equipment, and supplies for restaurants",,200000,ITRC,
http://www.bbc.co.uk/news/technology-15690187,,,300,Otro,Steam,,,hacked,35000000,1,web,,,2011,7,Attackers used login details from a Steam forum hack to access a database that held ID and credit card data.,,35000000,BBC News,The Valve Corporation
http://www.ehackingnews.com/2011/12/hackers-compromised-38-million-chinese.html,,,1,Otro,178.com,,,hacked,10000000,1,web,,,2011,7,,,10000000,eHacking News,gaming website
"http://www.pcmag.com/article2/0,2817,2387186,00.asp",,,1,Otro,Writerspace.com,,,hacked,62000,1,web,,,2011,7,Website design and hosting for writers,,62000,PC Mag,"Hacker group LulzSec released the e-mails and passwords, 12,000 of which were confirmed to originate from Writerspace.com."
http://www.reuters.com/article/2011/11/26/us-korea-hacking-nexon-idUSTRE7AP09H20111126,,,20,Otro,Nexon Korea Corp,,,hacked,13200000,1,web,,,2011,7,Personal data of subscribers to online game Maple Story was leaked.,,13200000,Reuters,game developer
"http://www.scmagazine.com.au/News/349585,28-million-clear-text-passwords-found-after-tianya65279-hack.aspx",,,1,Otro,Tianya,,,hacked,28000000,1,web,,,2011,7,"Usernames, clear tect passwords and email addresses hacked.",,28000000,SC Mag,blogging site
https://www.theguardian.com/technology/2011/apr/04/epsilon-email-hack,,,1,Otro,Epsilon,,,hacked,3000000,1,web,,,2011,7,Marketing email provider,,3000000,The Guardian,"Apr 2011. Names & email addresses of customers of Barclaycard US, Capital One, JP Morgan, Citigroup & other firms have been stolen."
http://www.zdnet.com/blog/security/chinese-hacker-arrested-for-leaking-6-million-logins/11064,,,1,Otro,China Software Developer Network,,,hacked,6000000,1,web,,,2011,7,,,6000000,ZD Net,
http://www.washingtonpost.com/business/technology/faq-the-global-payments-hack/2012/04/02/gIQAIHLLrS_story.html,,,300,Otro,Global Payments,,,hacked,1500000,1,financial,,,2012,8,"Credit, debit and check processing for merchants (Visa, Mastercard, etc)",,7000000,ITRC,1.5 million credit card numbers from its systems may have been exposed after detecting “unauthorized access” into its processing system.
https://us.battle.net/support/en/article/important-security-update-faq#5,,,20,Otro,Blizzard,,,hacked,14000000,1,gaming,,,2012,8,"Activision, Battle.net",,14000000,Blizzard,"Scrambled passwords, e-mail addresses, and personal security answers were knowingly stolen from Blizzard's internal network. Blizzard would not elaborate on the size of the hack (""millions"")."
http://www.infoworld.com/article/2615754/cyber-crime/south-carolina-reveals-massive-data-breach-of-social-security-numbers--credit-cards.html,,,3,Otro,South Carolina State Dept. of Revenue,,,hacked,3600000,1,government,,,2012,8,,,3600000,Information Week,A server was breached by an international hacker.
http://www.wired.co.uk/news/archive/2012-11/22/greece-id-theft,,,20,Otro,Greek government,,,hacked,9000000,1,government,,,2012,8,,,9000000,Wired,"A computer programmer was arrested in Greece for allegedly stealing the identity information of what could amount to 83% of the country's population. The 35-year-old was found in possession of 9 million data files containing identification card data, addresses, tax ID numbers and licence plate numbers, which he was also suspected of trying to sell."
http://it.slashdot.org/story/12/07/12/1243217/nearly-half-a-million-yahoo-passwords-leaked-updated?utm_source=feedburnerGoogle+Reader&utm_medium=feed&utm_campaign=Feed%3A+Slashdot%2Fslashdot+%28Slashdot%29&utm_content=Google+Reader,http://www.pbs.org/newshour/rundown/2012/07/check-whether-your-yahoo-password-was-hacked.html,,1,Otro,Yahoo Voices,,,hacked,500000,1,"tech, web",,,2012,8,,,450000,Slashdot,"Yahoo Voices service was hacked, exposing more than 450,000 usernames and passwords."
http://www.koreatimes.co.kr/www/news/biz/2012/07/113_116143.html,http://news.cnet.com/8301-1009_3-57482215-83/hackers-accused-of-stealing-data-from-9m-korean-mobile-users/,,20,Otro,KT Corp.,,,hacked,8700000,1,telecoms,,,2012,8,Korean mobile carrier,,8700000,Korea Times,"Two suspects reportedly earnt an estimated $877,000 by selling the contact information and plan details of 8.7 million KT subscribers, almost half of the carrier's total customers."
http://money.cnn.com/2016/05/19/technology/linkedin-hack/,,,1,Otro,LinkedIn,,,hacked,117000000,1,web,,,2012,8,,,117000000,CNN,Information about a 2012 data breach has just come to light.
http://www.forbes.com/sites/andygreenberg/2012/01/15/zappos-says-hackers-accessed-24-million-customers-account-details/,,,20,Otro,Zappos,,,hacked,24000000,1,web,,,2012,8,,,24000000,Forbes,
http://www.forbes.com/sites/andygreenberg/2012/07/23/eight-million-passwords-spilled-from-gaming-site-gamigo-months-after-breach/,,,1,Otro,Gamigo,,,hacked,8000000,1,web,,,2012,8,,,8000000,Forbes,German gaming website
http://www.informationweek.co.uk/security/client/dropbox-admits-hack-adds-more-security-f/240004697,,,1,Otro,Dropbox,,,hacked,30000,1,web,,,2012,8,Websites stolen from other websites used to sign into a small number of Dropbox accounts. The hack was mainly used to send spam to users.,,30000,Information Week,
http://www.telegraph.co.uk/technology/2016/08/31/dropbox-hackers-stole-70-million-passwords-and-email-addresses/,,,1,Otro,Dropbox,,,hacked,68700000,1,web,,,2012,8,,,68700000,The Telegraph,"User credentials were stolen in a 2012 hack, but the number affected has only just come to light."
http://www.zdnet.com/article/disqus-confirms-comments-tool-hacked/,,,4000,Otro,Disqus,,,hacked,17500000,1,web,,,2012,8,,,17500000,ZD Net,"hackers 17.5m email addresses in July 2012. About a third of those accounts contained passwords, which were hashed using the dated SHA-1 algorithm"
http://www.zdnet.com/article/hackers-stole-43-million-last-fm-account-details-in-2012-breach/,,,1,Otro,Last.fm,,,hacked,43500000,1,web,,,2012,8,Owned by CBS,,43500000,ZD Net,"Historical 2012 hack, details have only just been disclosed."
http://news.cnet.com/8301-1009_3-57449325-83/what-the-password-leaks-mean-to-you-faq/?tag=mncol;txt,http://arstechnica.com/security/2012/06/8-million-leaked-passwords-connected-to-linkedin/,,1,Otro,"LinkedIn, eHarmony, Last.fm",,,hacked,8000000,1,web,,,2012,8,,,8000000,CNET,"Hacker 'dwdm' uploaded a file containing 6.5 million passwords on a Russian hacker forum. Soon after another 1.5 million passwords were discovered.  On analysis, 93% of the passwords could be found in the Top 10,000 password list."
http://www.pcworld.com/article/252647/reborn_lulzsec_claims_hack_of_dating_site_for_military_personnel.html,,,1,Otro,Militarysingles.com,,,hacked,180000,1,"web, military",,,2012,8,"Online dating network for, you guessed it, military singles",,163792,PC World,"Collective group LulzSec released a database of 163,792 names, usernames, e-mail addresses, IP addresses, and passwords of ""single"" military personnel."
http://www.privacyrights.org/data-breach,http://www.databreachwatch.org/community-college-data-breach-leaks-125000-ssns/,,20,Otro,Kirkwood Community College,,,hacked,130000,1,academic,,,2013,9,Hacked online database,,125000,Privacy Rights,
http://www.privacyrights.org/data-breach,,,300,Otro,Central Hudson Gas & Electric,,,hacked,100000,1,energy,,,2013,9,,,110000,Privacy Rights,Customer banking information and other personal information may have been accessed during the hack.
http://www.joystiq.com/2013/07/05/club-nintendo-japan-hacked/,,,20,Otro,Nintendo,,,hacked,250000,1,gaming,,,2013,9,Japan's Club Nintendo service,,240000,JoyStiq,"Japan's Club Nintendo service was hacked following thousands of unauthorized accesses. Customer information compromised in the attack includes full names, phone numbers, home and email addresses."
http://forums.ubi.com/forumdisplay.php/495-Security-update-regarding-your-Ubisoft-account-please-create-a-new-password,,,20,Otro,UbiSoft,,,hacked,58000000,1,gaming,,,2013,9,games company,,,UBI,
http://www.reuters.com/article/2013/05/09/us-usa-hack-washingtonstate-idUSBRE9480YY20130509,http://www.privacyrights.org/data-breach,,20,Otro,Washington State court system,,,hacked,160000,1,government,,,2013,9,Administrative offices,,160000,Reuters; Privacy Rights,"Up to 160,000 Social Security numbers and a million driver's license numbers may have been accessed by hackers exploiting old versions of Adobe Cold Fusion software on the server."
http://www.guardian.co.uk/technology/2013/jul/22/apple-developer-site-hacked,,,1,Otro,Apple,,,hacked,300000,1,tech,,,2013,9,,,275000,The Guardian,"Developer portal hacked. ""Some"" information about 275,000 3rd-party developers potentially stolen."
http://www.reuters.com/article/2013/05/17/us-yahoojapan-idUSBRE94G0P620130517,,,1,Otro,Yahoo Japan,,,hacked,22000000,1,"tech, web",,,2013,9,,,22000000,Reuters,22 million Yahoo user IDs may have been leaked after Yahoo detected an unauthorized attempt to access the administrative system of its web portal Yahoo Japan. The leaked information did not include passwords and data necessary for identity verification to reset passwords.
http://arstechnica.com/security/2013/05/drupal-org-resets-login-credentials-after-hack-exposes-password-data/,,,1,Otro,Drupal,,,hacked,1000000,1,web,,,2013,9,open-source content management platform,,1000000,Ars Technica,"Malicious files placed on association.drupal.org servers via a 3rd-party application. Exposed usernames, e-mail addresses, country information, and cryptographically hashed passwords."
https://motherboard.vice.com/read/hackers-stole-68-million-passwords-from-tumblr-new-analysis-reveals,,,1,Otro,Tumblr,,,hacked,65000000,1,web,,,2013,9,,,65000000,Motherboard,"Tumblr apparently only just found out about a 2013 data breach, affecting 65m users."
http://www.nytimes.com/2016/12/14/technology/yahoo-hack.html?action=Click&contentCollection=BreakingNews&contentID=64651831&pgtype=Homepage&_r=0,,,20,Otro,Yahoo,,,hacked,1000000000,1,web,,,2013,9,,,1000000000,NY Times,"Happened in 2013 but only disclosed late 2016. Data included names, telephone numbers, DOBs, passwords and security questions."
http://status.ovh.net/?do=details&id=5070,,,20,Otro,OVH,,,hacked,500000,1,web,,,2013,9,French Internet host,,,OVH,
http://www.wired.co.uk/news/archive/2013-02/02/twitter-hacked,,,1,Otro,Twitter,,,hacked,250000,1,web,,,2013,9,,,250000,Wired,"Hackers had access to limited user information -- usernames, email addresses, session tokens and encrypted/salted versions of passwords -- for approximately 250,000 users."
